Review_Bersih,Review_Stopwords,Review_Stemming,Review_Stop_Stem,Review_Stop_Joined,Review_Stem_Joined,Review_Stop_Stem_Joined,Review_Stop_Neg,Review_Stem_Neg,Review_Stop_Stem_Neg,Sentibar,Aspbar
jika ingin kemari saya sarankan gunakan shirt celana santai sepatu sport topi,ingin kemari sarankan gunakan shirt celana santai sepatu sport topi,jika ingin kemari saya saran guna shirt celana santai sepatu sport topi,ingin kemari saran guna shirt celana santai sepatu sport topi,ingin kemari sarankan gunakan shirt celana santai sepatu sport topi,jika ingin kemari saya saran guna shirt celana santai sepatu sport topi,ingin kemari saran guna shirt celana santai sepatu sport topi,ingin kemari sarankan gunakan shirt celana santai sepatu sport topi,jika ingin kemari saya saran guna shirt celana santai sepatu sport topi,ingin kemari saran guna shirt celana santai sepatu sport topi,positif,serbaneka
pastinya sangat berkesan untuk kita,pastinya berkesan,pasti sangat kesan untuk kita,pasti kesan,pastinya berkesan,pasti sangat kesan untuk kita,pasti kesan,pastinya berkesan,pasti sangat kesan untuk kita,pasti kesan,positif,serbaneka
salah satu tempat rekomndasi bagi travelers dari dalam negeri mancanegara,satu tempat rekomndasi travelers negeri mancanegara,salah satu tempat rekomndasi bagi travelers dari dalam negeri mancanegara,satu tempat rekomndasi travelers negeri mancanegara,satu tempat rekomndasi travelers negeri mancanegara,salah satu tempat rekomndasi bagi travelers dari dalam negeri mancanegara,satu tempat rekomndasi travelers negeri mancanegara,satu tempat rekomndasi travelers negeri mancanegara,salah satu tempat rekomndasi bagi travelers dari dalam negeri mancanegara,satu tempat rekomndasi travelers negeri mancanegara,positif,serbaneka
sudah kali datang kesini,kali datang kesini,sudah kali datang kesini,kali datang kesini,kali datang kesini,sudah kali datang kesini,kali datang kesini,kali datang kesini,sudah kali datang kesini,kali datang kesini,positif,serbaneka
kami sekeluarga berlibur yogya dimana kami sempatkan pula untuk jalan jalan magelang tepatnya candi borobudur,sekeluarga berlibur yogya dimana sempatkan jalan jalan magelang tepatnya candi borobudur,kami keluarga libur yogya mana kami sempat pula untuk jalan jalan magelang tepat candi borobudur,keluarga libur yogya mana sempat jalan jalan magelang tepat candi borobudur,sekeluarga berlibur yogya dimana sempatkan jalan jalan magelang tepatnya candi borobudur,kami keluarga libur yogya mana kami sempat pula untuk jalan jalan magelang tepat candi borobudur,keluarga libur yogya mana sempat jalan jalan magelang tepat candi borobudur,sekeluarga berlibur yogya dimana sempatkan jalan jalan magelang tepatnya candi borobudur,kami keluarga libur yogya mana kami sempat pula untuk jalan jalan magelang tepat candi borobudur,keluarga libur yogya mana sempat jalan jalan magelang tepat candi borobudur,positif,serbaneka
sengaja kami berkunjung sana untuk menunjukkan secara langsug salah satu keajaiban dunia kepada putra putri kami sebagai generasi penerus bangsa yang diharapkan senantiasa dapat memelihara menjaga keberadaan serta kelestarian candi borobudur sekaligus keindahan alam sekitar candi,sengaja berkunjung menunjukkan langsug satu keajaiban dunia kepada putra putri generasi penerus bangsa diharapkan memelihara menjaga keberadaan kelestarian candi borobudur keindahan alam sekitar candi,sengaja kami kunjung sana untuk tunjuk cara langsug salah satu ajaib dunia kepada putra putri kami bagai generasi terus bangsa yang harap senantiasa dapat pelihara jaga ada serta lestari candi borobudur sekaligus indah alam sekitar candi,sengaja kunjung tunjuk langsug satu ajaib dunia kepada putra putri generasi terus bangsa harap pelihara jaga ada lestari candi borobudur indah alam sekitar candi,sengaja berkunjung menunjukkan langsug satu keajaiban dunia kepada putra putri generasi penerus bangsa diharapkan memelihara menjaga keberadaan kelestarian candi borobudur keindahan alam sekitar candi,sengaja kami kunjung sana untuk tunjuk cara langsug salah satu ajaib dunia kepada putra putri kami bagai generasi terus bangsa yang harap senantiasa dapat pelihara jaga ada serta lestari candi borobudur sekaligus indah alam sekitar candi,sengaja kunjung tunjuk langsug satu ajaib dunia kepada putra putri generasi terus bangsa harap pelihara jaga ada lestari candi borobudur indah alam sekitar candi,sengaja berkunjung menunjukkan langsug satu keajaiban dunia kepada putra putri generasi penerus bangsa diharapkan memelihara menjaga keberadaan kelestarian candi borobudur keindahan alam sekitar candi,sengaja kami kunjung sana untuk tunjuk cara langsug salah satu ajaib dunia kepada putra putri kami bagai generasi terus bangsa yang harap senantiasa dapat pelihara jaga ada serta lestari candi borobudur sekaligus indah alam sekitar candi,sengaja kunjung tunjuk langsug satu ajaib dunia kepada putra putri generasi terus bangsa harap pelihara jaga ada lestari candi borobudur indah alam sekitar candi,positif,serbaneka
siapkan kaki anda,siapkan kaki,siap kaki anda,siap kaki,siapkan kaki,siap kaki anda,siap kaki,siapkan kaki,siap kaki anda,siap kaki,positif,serbaneka
candi borobudur terdapat arca arca yang menarik banyak bule pada datang tempat,candi borobudur arca arca menarik bule datang tempat,candi borobudur dapat arca arca yang tarik banyak bule pada datang tempat,candi borobudur arca arca tarik bule datang tempat,candi borobudur arca arca menarik bule datang tempat,candi borobudur dapat arca arca yang tarik banyak bule pada datang tempat,candi borobudur arca arca tarik bule datang tempat,candi borobudur arca arca menarik bule datang tempat,candi borobudur dapat arca arca yang tarik banyak bule pada datang tempat,candi borobudur arca arca tarik bule datang tempat,positif,serbaneka
luar candi terdapat halaman yang luas terdapat sejarah sejarah untuk memperluas ilmu pengetahuan pokoknya banyak,luar candi halaman luas sejarah sejarah memperluas ilmu pengetahuan pokoknya,luar candi dapat halaman yang luas dapat sejarah sejarah untuk luas ilmu tahu pokok banyak,luar candi halaman luas sejarah sejarah luas ilmu tahu pokok,luar candi halaman luas sejarah sejarah memperluas ilmu pengetahuan pokoknya,luar candi dapat halaman yang luas dapat sejarah sejarah untuk luas ilmu tahu pokok banyak,luar candi halaman luas sejarah sejarah luas ilmu tahu pokok,luar candi halaman luas sejarah sejarah memperluas ilmu pengetahuan pokoknya,luar candi dapat halaman yang luas dapat sejarah sejarah untuk luas ilmu tahu pokok banyak,luar candi halaman luas sejarah sejarah luas ilmu tahu pokok,positif,serbaneka
turun setelah keliling candi,turun keliling candi,turun telah keliling candi,turun keliling candi,turun keliling candi,turun telah keliling candi,turun keliling candi,turun keliling candi,turun telah keliling candi,turun keliling candi,positif,serbaneka
tempat wisata sejarah bukti peninggalan kerajaan zaman mataram kuno yang masih pernah menjadi salah satu keajaiban dunia,tempat wisata sejarah bukti peninggalan kerajaan zaman mataram kuno satu keajaiban dunia,tempat wisata sejarah bukti tinggal raja zaman mataram kuno yang masih pernah jadi salah satu ajaib dunia,tempat wisata sejarah bukti tinggal raja zaman mataram kuno satu ajaib dunia,tempat wisata sejarah bukti peninggalan kerajaan zaman mataram kuno satu keajaiban dunia,tempat wisata sejarah bukti tinggal raja zaman mataram kuno yang masih pernah jadi salah satu ajaib dunia,tempat wisata sejarah bukti tinggal raja zaman mataram kuno satu ajaib dunia,tempat wisata sejarah bukti peninggalan kerajaan zaman mataram kuno satu keajaiban dunia,tempat wisata sejarah bukti tinggal raja zaman mataram kuno yang masih pernah jadi salah satu ajaib dunia,tempat wisata sejarah bukti tinggal raja zaman mataram kuno satu ajaib dunia,positif,serbaneka
kali anak anak diajak candi borobudur antusias sekali ingin segera sampai,kali anak anak diajak candi borobudur antusias ingin segera,kali anak anak ajak candi borobudur antusias sekali ingin segera sampai,kali anak anak ajak candi borobudur antusias ingin segera,kali anak anak diajak candi borobudur antusias ingin segera,kali anak anak ajak candi borobudur antusias sekali ingin segera sampai,kali anak anak ajak candi borobudur antusias ingin segera,kali anak anak diajak candi borobudur antusias ingin segera,kali anak anak ajak candi borobudur antusias sekali ingin segera sampai,kali anak anak ajak candi borobudur antusias ingin segera,positif,serbaneka
didalamnya kamu bakal menemukan cerita sejarah keraton jogja solo,didalamnya menemukan cerita sejarah keraton jogja solo,dalam kamu bakal temu cerita sejarah keraton jogja solo,dalam temu cerita sejarah keraton jogja solo,didalamnya menemukan cerita sejarah keraton jogja solo,dalam kamu bakal temu cerita sejarah keraton jogja solo,dalam temu cerita sejarah keraton jogja solo,didalamnya menemukan cerita sejarah keraton jogja solo,dalam kamu bakal temu cerita sejarah keraton jogja solo,dalam temu cerita sejarah keraton jogja solo,positif,serbaneka
museum adalah milik pribadi dimana dalam museum tersebut beberapa koleksi dari sejarah kerajaan yogyakarta solo,museum milik pribadi dimana museum koleksi sejarah kerajaan yogyakarta solo,museum adalah milik pribadi mana dalam museum sebut beberapa koleksi dari sejarah raja yogyakarta solo,museum milik pribadi mana museum koleksi sejarah raja yogyakarta solo,museum milik pribadi dimana museum koleksi sejarah kerajaan yogyakarta solo,museum adalah milik pribadi mana dalam museum sebut beberapa koleksi dari sejarah raja yogyakarta solo,museum milik pribadi mana museum koleksi sejarah raja yogyakarta solo,museum milik pribadi dimana museum koleksi sejarah kerajaan yogyakarta solo,museum adalah milik pribadi mana dalam museum sebut beberapa koleksi dari sejarah raja yogyakarta solo,museum milik pribadi mana museum koleksi sejarah raja yogyakarta solo,positif,serbaneka
museum menyimpan koleksi dari photo photo kerajaan yang sudah reproduksi kembali,museum menyimpan koleksi photo photo kerajaan reproduksi kembali,museum simpan koleksi dari photo photo raja yang sudah reproduksi kembali,museum simpan koleksi photo photo raja reproduksi kembali,museum menyimpan koleksi photo photo kerajaan reproduksi kembali,museum simpan koleksi dari photo photo raja yang sudah reproduksi kembali,museum simpan koleksi photo photo raja reproduksi kembali,museum menyimpan koleksi photo photo kerajaan reproduksi kembali,museum simpan koleksi dari photo photo raja yang sudah reproduksi kembali,museum simpan koleksi photo photo raja reproduksi kembali,positif,serbaneka
koleksi batik arti dari batik pakaian kerajaan yogya solo,koleksi batik arti batik pakaian kerajaan yogya solo,koleksi batik arti dari batik pakai raja yogya solo,koleksi batik arti batik pakai raja yogya solo,koleksi batik arti batik pakaian kerajaan yogya solo,koleksi batik arti dari batik pakai raja yogya solo,koleksi batik arti batik pakai raja yogya solo,koleksi batik arti batik pakaian kerajaan yogya solo,koleksi batik arti dari batik pakai raja yogya solo,koleksi batik arti batik pakai raja yogya solo,positif,serbaneka
tarif untuk masuk museum tersebut untuk dewasa untuk anak,tarif masuk museum dewasa anak,tarif untuk masuk museum sebut untuk dewasa untuk anak,tarif masuk museum dewasa anak,tarif masuk museum dewasa anak,tarif untuk masuk museum sebut untuk dewasa untuk anak,tarif masuk museum dewasa anak,tarif masuk museum dewasa anak,tarif untuk masuk museum sebut untuk dewasa untuk anak,tarif masuk museum dewasa anak,positif,serbaneka
sejarah budaya jawa yang sangat menarik bisa didapatkan disini,sejarah budaya jawa menarik didapatkan disini,sejarah budaya jawa yang sangat tarik bisa dapat sini,sejarah budaya jawa tarik dapat sini,sejarah budaya jawa menarik didapatkan disini,sejarah budaya jawa yang sangat tarik bisa dapat sini,sejarah budaya jawa tarik dapat sini,sejarah budaya jawa menarik didapatkan disini,sejarah budaya jawa yang sangat tarik bisa dapat sini,sejarah budaya jawa tarik dapat sini,positif,serbaneka
semua yang museum masih melekat diingatan,museum melekat diingatan,semua yang museum masih lekat ingat,museum lekat ingat,museum melekat diingatan,semua yang museum masih lekat ingat,museum lekat ingat,museum melekat diingatan,semua yang museum masih lekat ingat,museum lekat ingat,positif,serbaneka
museum ullen sentalu bisa dibilang sebagai museum yang unik,museum ullen sentalu dibilang museum unik,museum ullen sentalu bisa bilang bagai museum yang unik,museum ullen sentalu bilang museum unik,museum ullen sentalu dibilang museum unik,museum ullen sentalu bisa bilang bagai museum yang unik,museum ullen sentalu bilang museum unik,museum ullen sentalu dibilang museum unik,museum ullen sentalu bisa bilang bagai museum yang unik,museum ullen sentalu bilang museum unik,positif,serbaneka
dijamin pulang dari sini kamu terasa lebih muda tahun dari umur aslimu,dijamin pulang sini terasa muda tahun umur aslimu,jamin pulang dari sini kamu asa lebih muda tahun dari umur asli,jamin pulang sini asa muda tahun umur asli,dijamin pulang sini terasa muda tahun umur aslimu,jamin pulang dari sini kamu asa lebih muda tahun dari umur asli,jamin pulang sini asa muda tahun umur asli,dijamin pulang sini terasa muda tahun umur aslimu,jamin pulang dari sini kamu asa lebih muda tahun dari umur asli,jamin pulang sini asa muda tahun umur asli,positif,serbaneka
membaca sejarah yang ditampilkan museum ullen sentalu adalah pengalaman menyenangkan,membaca sejarah ditampilkan museum ullen sentalu pengalaman menyenangkan,baca sejarah yang tampil museum ullen sentalu adalah alam senang,baca sejarah tampil museum ullen sentalu alam senang,membaca sejarah ditampilkan museum ullen sentalu pengalaman menyenangkan,baca sejarah yang tampil museum ullen sentalu adalah alam senang,baca sejarah tampil museum ullen sentalu alam senang,membaca sejarah ditampilkan museum ullen sentalu pengalaman menyenangkan,baca sejarah yang tampil museum ullen sentalu adalah alam senang,baca sejarah tampil museum ullen sentalu alam senang,positif,serbaneka
wisata sejarah yang sangat fantastis,wisata sejarah fantastis,wisata sejarah yang sangat fantastis,wisata sejarah fantastis,wisata sejarah fantastis,wisata sejarah yang sangat fantastis,wisata sejarah fantastis,wisata sejarah fantastis,wisata sejarah yang sangat fantastis,wisata sejarah fantastis,positif,serbaneka
salah satu tempat untuk mempelajari batik sejarah kerajaan jogja jawa kisah kisah raja putri kerajaan terdahulu sinilah tempat yang menarik,satu tempat mempelajari batik sejarah kerajaan jogja jawa kisah kisah raja putri kerajaan terdahulu sinilah tempat menarik,salah satu tempat untuk ajar batik sejarah raja jogja jawa kisah kisah raja putri raja dahulu sini tempat yang tarik,satu tempat ajar batik sejarah raja jogja jawa kisah kisah raja putri raja dahulu sini tempat tarik,satu tempat mempelajari batik sejarah kerajaan jogja jawa kisah kisah raja putri kerajaan terdahulu sinilah tempat menarik,salah satu tempat untuk ajar batik sejarah raja jogja jawa kisah kisah raja putri raja dahulu sini tempat yang tarik,satu tempat ajar batik sejarah raja jogja jawa kisah kisah raja putri raja dahulu sini tempat tarik,satu tempat mempelajari batik sejarah kerajaan jogja jawa kisah kisah raja putri kerajaan terdahulu sinilah tempat menarik,salah satu tempat untuk ajar batik sejarah raja jogja jawa kisah kisah raja putri raja dahulu sini tempat yang tarik,satu tempat ajar batik sejarah raja jogja jawa kisah kisah raja putri raja dahulu sini tempat tarik,positif,serbaneka
banget,banget,banget,banget,banget,banget,banget,banget,banget,banget,positif,serbaneka
museum ullen sentalu merupakan museum budaya jawa terbaik yang pernah saya datangi,museum ullen sentalu merupakan museum budaya jawa terbaik datangi,museum ullen sentalu rupa museum budaya jawa baik yang pernah saya datang,museum ullen sentalu rupa museum budaya jawa baik datang,museum ullen sentalu merupakan museum budaya jawa terbaik datangi,museum ullen sentalu rupa museum budaya jawa baik yang pernah saya datang,museum ullen sentalu rupa museum budaya jawa baik datang,museum ullen sentalu merupakan museum budaya jawa terbaik datangi,museum ullen sentalu rupa museum budaya jawa baik yang pernah saya datang,museum ullen sentalu rupa museum budaya jawa baik datang,positif,serbaneka
museum menyimpan koleksi kebudayaan jawa sejarah terbentuknya keraton jogja solo,museum menyimpan koleksi kebudayaan jawa sejarah terbentuknya keraton jogja solo,museum simpan koleksi budaya jawa sejarah bentuk keraton jogja solo,museum simpan koleksi budaya jawa sejarah bentuk keraton jogja solo,museum menyimpan koleksi kebudayaan jawa sejarah terbentuknya keraton jogja solo,museum simpan koleksi budaya jawa sejarah bentuk keraton jogja solo,museum simpan koleksi budaya jawa sejarah bentuk keraton jogja solo,museum menyimpan koleksi kebudayaan jawa sejarah terbentuknya keraton jogja solo,museum simpan koleksi budaya jawa sejarah bentuk keraton jogja solo,museum simpan koleksi budaya jawa sejarah bentuk keraton jogja solo,positif,serbaneka
disini saya baru paham mengenai arti symbol yang batik,disini baru paham mengenai arti symbol batik,sini saya baru paham kena arti symbol yang batik,sini baru paham kena arti symbol batik,disini baru paham mengenai arti symbol batik,sini saya baru paham kena arti symbol yang batik,sini baru paham kena arti symbol batik,disini baru paham mengenai arti symbol batik,sini saya baru paham kena arti symbol yang batik,sini baru paham kena arti symbol batik,positif,serbaneka
harga masuk sudah dengan pemandu,harga masuk pemandu,harga masuk sudah dengan pandu,harga masuk pandu,harga masuk pemandu,harga masuk sudah dengan pandu,harga masuk pandu,harga masuk pemandu,harga masuk sudah dengan pandu,harga masuk pandu,positif,serbaneka
biaya masuk terjangkau,biaya masuk terjangkau,biaya masuk jangkau,biaya masuk jangkau,biaya masuk terjangkau,biaya masuk jangkau,biaya masuk jangkau,biaya masuk terjangkau,biaya masuk jangkau,biaya masuk jangkau,positif,serbaneka
pelajaran sejarah dengan melihat langsung peninggalan jaman dahulu beserta arsip arsip,pelajaran sejarah melihat langsung peninggalan jaman beserta arsip arsip,ajar sejarah dengan lihat langsung tinggal jaman dahulu serta arsip arsip,ajar sejarah lihat langsung tinggal jaman serta arsip arsip,pelajaran sejarah melihat langsung peninggalan jaman beserta arsip arsip,ajar sejarah dengan lihat langsung tinggal jaman dahulu serta arsip arsip,ajar sejarah lihat langsung tinggal jaman serta arsip arsip,pelajaran sejarah melihat langsung peninggalan jaman beserta arsip arsip,ajar sejarah dengan lihat langsung tinggal jaman dahulu serta arsip arsip,ajar sejarah lihat langsung tinggal jaman serta arsip arsip,positif,serbaneka
museum yang sangat unik,museum unik,museum yang sangat unik,museum unik,museum unik,museum yang sangat unik,museum unik,museum unik,museum yang sangat unik,museum unik,positif,serbaneka
awal kesini karena suruh survey,awal kesini suruh survey,awal kesini karena suruh survey,awal kesini suruh survey,awal kesini suruh survey,awal kesini karena suruh survey,awal kesini suruh survey,awal kesini suruh survey,awal kesini karena suruh survey,awal kesini suruh survey,positif,serbaneka
dengan mengunjungi museum kita dapat lebih mengetahui sejarah keraton yogya solo terutama kehidupan dari beberapa anggota keluarga keraton,mengunjungi museum mengetahui sejarah keraton yogya solo terutama kehidupan anggota keluarga keraton,dengan unjung museum kita dapat lebih tahu sejarah keraton yogya solo utama hidup dari beberapa anggota keluarga keraton,unjung museum tahu sejarah keraton yogya solo utama hidup anggota keluarga keraton,mengunjungi museum mengetahui sejarah keraton yogya solo terutama kehidupan anggota keluarga keraton,dengan unjung museum kita dapat lebih tahu sejarah keraton yogya solo utama hidup dari beberapa anggota keluarga keraton,unjung museum tahu sejarah keraton yogya solo utama hidup anggota keluarga keraton,mengunjungi museum mengetahui sejarah keraton yogya solo terutama kehidupan anggota keluarga keraton,dengan unjung museum kita dapat lebih tahu sejarah keraton yogya solo utama hidup dari beberapa anggota keluarga keraton,unjung museum tahu sejarah keraton yogya solo utama hidup anggota keluarga keraton,positif,serbaneka
historis penuh budaya jawa,historis penuh budaya jawa,historis penuh budaya jawa,historis penuh budaya jawa,historis penuh budaya jawa,historis penuh budaya jawa,historis penuh budaya jawa,historis penuh budaya jawa,historis penuh budaya jawa,historis penuh budaya jawa,positif,serbaneka
tempatnya,tempatnya,tempat,tempat,tempatnya,tempat,tempat,tempatnya,tempat,tempat,positif,serbaneka
lukisan lukisan yang tersedia juga sangat menarik untuk dilihat,lukisan lukisan tersedia menarik dilihat,lukis lukis yang sedia juga sangat tarik untuk lihat,lukis lukis sedia tarik lihat,lukisan lukisan tersedia menarik dilihat,lukis lukis yang sedia juga sangat tarik untuk lihat,lukis lukis sedia tarik lihat,lukisan lukisan tersedia menarik dilihat,lukis lukis yang sedia juga sangat tarik untuk lihat,lukis lukis sedia tarik lihat,positif,serbaneka
museum koleksi pribadi,museum koleksi pribadi,museum koleksi pribadi,museum koleksi pribadi,museum koleksi pribadi,museum koleksi pribadi,museum koleksi pribadi,museum koleksi pribadi,museum koleksi pribadi,museum koleksi pribadi,positif,serbaneka
sekali wisata mencapai waktu sekitar menitan,wisata mencapai waktu sekitar menitan,sekali wisata capai waktu sekitar menit,wisata capai waktu sekitar menit,wisata mencapai waktu sekitar menitan,sekali wisata capai waktu sekitar menit,wisata capai waktu sekitar menit,wisata mencapai waktu sekitar menitan,sekali wisata capai waktu sekitar menit,wisata capai waktu sekitar menit,positif,serbaneka
saya pasti akan mengunjungi ulen sentalu lagi,pasti mengunjungi ulen sentalu,saya pasti akan unjung ulen sentalu lagi,pasti unjung ulen sentalu,pasti mengunjungi ulen sentalu,saya pasti akan unjung ulen sentalu lagi,pasti unjung ulen sentalu,pasti mengunjungi ulen sentalu,saya pasti akan unjung ulen sentalu lagi,pasti unjung ulen sentalu,positif,serbaneka
mengenal lebih jauh silsilah keluarga kerajaan mataram budaya sejarah peradaban,mengenal jauh silsilah keluarga kerajaan mataram budaya sejarah peradaban,kenal lebih jauh silsilah keluarga raja mataram budaya sejarah adab,kenal jauh silsilah keluarga raja mataram budaya sejarah adab,mengenal jauh silsilah keluarga kerajaan mataram budaya sejarah peradaban,kenal lebih jauh silsilah keluarga raja mataram budaya sejarah adab,kenal jauh silsilah keluarga raja mataram budaya sejarah adab,mengenal jauh silsilah keluarga kerajaan mataram budaya sejarah peradaban,kenal lebih jauh silsilah keluarga raja mataram budaya sejarah adab,kenal jauh silsilah keluarga raja mataram budaya sejarah adab,positif,serbaneka
museum merupakan milik pribadi yang dikelola dengan sangat bagus,museum merupakan milik pribadi dikelola bagus,museum rupa milik pribadi yang kelola dengan sangat bagus,museum rupa milik pribadi kelola bagus,museum merupakan milik pribadi dikelola bagus,museum rupa milik pribadi yang kelola dengan sangat bagus,museum rupa milik pribadi kelola bagus,museum merupakan milik pribadi dikelola bagus,museum rupa milik pribadi yang kelola dengan sangat bagus,museum rupa milik pribadi kelola bagus,positif,serbaneka
jika ingin mengetahui secara mendalam tentang keluarga keraton yogya datanglah kemari,ingin mengetahui mendalam tentang keluarga keraton yogya datanglah kemari,jika ingin tahu cara dalam tentang keluarga keraton yogya datang kemari,ingin tahu dalam tentang keluarga keraton yogya datang kemari,ingin mengetahui mendalam tentang keluarga keraton yogya datanglah kemari,jika ingin tahu cara dalam tentang keluarga keraton yogya datang kemari,ingin tahu dalam tentang keluarga keraton yogya datang kemari,ingin mengetahui mendalam tentang keluarga keraton yogya datanglah kemari,jika ingin tahu cara dalam tentang keluarga keraton yogya datang kemari,ingin tahu dalam tentang keluarga keraton yogya datang kemari,positif,serbaneka
dengan biaya rupiah kita berdelapan masuk museum,biaya rupiah berdelapan masuk museum,dengan biaya rupiah kita delapan masuk museum,biaya rupiah delapan masuk museum,biaya rupiah berdelapan masuk museum,dengan biaya rupiah kita delapan masuk museum,biaya rupiah delapan masuk museum,biaya rupiah berdelapan masuk museum,dengan biaya rupiah kita delapan masuk museum,biaya rupiah delapan masuk museum,positif,serbaneka
jadi museum mengenai silsilah keluarga keraton dari pecahnya kerajaan pulau jawa sampai sekarang,museum mengenai silsilah keluarga keraton pecahnya kerajaan pulau jawa sekarang,jadi museum kena silsilah keluarga keraton dari pecah raja pulau jawa sampai sekarang,museum kena silsilah keluarga keraton pecah raja pulau jawa sekarang,museum mengenai silsilah keluarga keraton pecahnya kerajaan pulau jawa sekarang,jadi museum kena silsilah keluarga keraton dari pecah raja pulau jawa sampai sekarang,museum kena silsilah keluarga keraton pecah raja pulau jawa sekarang,museum mengenai silsilah keluarga keraton pecahnya kerajaan pulau jawa sekarang,jadi museum kena silsilah keluarga keraton dari pecah raja pulau jawa sampai sekarang,museum kena silsilah keluarga keraton pecah raja pulau jawa sekarang,positif,serbaneka
overall kalau kita tertarik sejarah museum bagus,overall tertarik sejarah museum bagus,overall kalau kita tarik sejarah museum bagus,overall tarik sejarah museum bagus,overall tertarik sejarah museum bagus,overall kalau kita tarik sejarah museum bagus,overall tarik sejarah museum bagus,overall tertarik sejarah museum bagus,overall kalau kita tarik sejarah museum bagus,overall tarik sejarah museum bagus,positif,serbaneka
museum unik,museum unik,museum unik,museum unik,museum unik,museum unik,museum unik,museum unik,museum unik,museum unik,positif,serbaneka
