Review_Bersih,Review_Stopwords,Review_Stemming,Review_Stop_Stem,Review_Stop_Joined,Review_Stem_Joined,Review_Stop_Stem_Joined,Review_Stop_Neg,Review_Stem_Neg,Review_Stop_Stem_Neg,Sentibar,Aspbar
pantai bukan pantai pasir putih,pantai bukan pantai pasir putih,pantai bukan pantai pasir putih,pantai bukan pantai pasir putih,pantai bukan_pantai  pasir putih,pantai bukan_pantai  pasir putih,pantai bukan_pantai  pasir putih,pantai bukan NEG_pantai pasir putih,pantai bukan NEG_pantai pasir putih,pantai bukan NEG_pantai pasir putih,positif,serbaneka
borobudur candi budha yang terletak didaerah magelang jawa tengah bukan hanya menawarkan kemegahan candinya saja,borobudur candi budha terletak didaerah magelang jawa tengah bukan menawarkan kemegahan candinya,borobudur candi budha yang letak daerah magelang jawa tengah bukan hanya tawar megah candi saja,borobudur candi budha letak daerah magelang jawa tengah bukan tawar megah candi,borobudur candi budha terletak didaerah magelang jawa tengah bukan_menawarkan  kemegahan candinya,borobudur candi budha yang letak daerah magelang jawa tengah bukan_hanya  tawar megah candi saja,borobudur candi budha letak daerah magelang jawa tengah bukan_tawar  megah candi,borobudur candi budha terletak didaerah magelang jawa tengah bukan NEG_menawarkan kemegahan candinya,borobudur candi budha yang letak daerah magelang jawa tengah bukan NEG_hanya tawar megah candi saja,borobudur candi budha letak daerah magelang jawa tengah bukan NEG_tawar megah candi,positif,serbaneka
pada dasarnya saya bukan tipe orang yang suka berkemah malas naik gunung malas kotoran,dasarnya bukan tipe suka berkemah malas naik gunung malas kotoran,pada dasar saya bukan tipe orang yang suka kemah malas naik gunung malas kotor,dasar bukan tipe suka kemah malas naik gunung malas kotor,dasarnya bukan_tipe  suka berkemah malas naik gunung malas kotoran,pada dasar saya bukan_tipe  orang yang suka kemah malas naik gunung malas kotor,dasar bukan_tipe  suka kemah malas naik gunung malas kotor,dasarnya bukan NEG_tipe suka berkemah malas naik gunung malas kotoran,pada dasar saya bukan NEG_tipe orang yang suka kemah malas naik gunung malas kotor,dasar bukan NEG_tipe suka kemah malas naik gunung malas kotor,negatif,serbaneka
kalau datang bukan week cukup sepi,datang bukan week cukup sepi,kalau datang bukan week cukup sepi,datang bukan week cukup sepi,datang bukan_week  cukup sepi,kalau datang bukan_week  cukup sepi,datang bukan_week  cukup sepi,datang bukan NEG_week cukup sepi,kalau datang bukan NEG_week cukup sepi,datang bukan NEG_week cukup sepi,positif,suasana
candi borobudur terletak dimagelang jawa tengah bukan yogyakarta,candi borobudur terletak dimagelang jawa tengah bukan yogyakarta,candi borobudur letak dimagelang jawa tengah bukan yogyakarta,candi borobudur letak dimagelang jawa tengah bukan yogyakarta,candi borobudur terletak dimagelang jawa tengah bukan_yogyakarta ,candi borobudur letak dimagelang jawa tengah bukan_yogyakarta ,candi borobudur letak dimagelang jawa tengah bukan_yogyakarta ,candi borobudur terletak dimagelang jawa tengah bukan NEG_yogyakarta,candi borobudur letak dimagelang jawa tengah bukan NEG_yogyakarta,candi borobudur letak dimagelang jawa tengah bukan NEG_yogyakarta,positif,serbaneka
lebih baik datang jangan hari libur,baik datang jangan hari libur,lebih baik datang jangan hari libur,baik datang jangan hari libur,baik datang jangan_hari  libur,lebih baik datang jangan_hari  libur,baik datang jangan_hari  libur,baik datang jangan NEG_hari libur,lebih baik datang jangan NEG_hari libur,baik datang jangan NEG_hari libur,positif,serbaneka
melihat kemegahan borobudurketika dilokasi jangan kaget karena akan penuh sesak banyak orang berselfie bagi kita yang lebih suka menikmati kemegahan bangunan mungkin akan sedikit terkalahkan oleh orang selfie yang seakan seakan menguasai tempat,melihat kemegahan borobudurketika dilokasi jangan kaget penuh sesak berselfie suka menikmati kemegahan bangunan sedikit terkalahkan oleh selfie menguasai tempat,lihat megah borobudurketika lokasi jangan kaget karena akan penuh sesak banyak orang berselfie bagi kita yang lebih suka nikmat megah bangun mungkin akan sedikit kalah oleh orang selfie yang akan akan kuasa tempat,lihat megah borobudurketika lokasi jangan kaget penuh sesak berselfie suka nikmat megah bangun sedikit kalah oleh selfie kuasa tempat,melihat kemegahan borobudurketika dilokasi jangan_kaget  penuh sesak berselfie suka menikmati kemegahan bangunan sedikit terkalahkan oleh selfie menguasai tempat,lihat megah borobudurketika lokasi jangan_kaget  karena akan penuh sesak banyak orang berselfie bagi kita yang lebih suka nikmat megah bangun mungkin akan sedikit kalah oleh orang selfie yang akan akan kuasa tempat,lihat megah borobudurketika lokasi jangan_kaget  penuh sesak berselfie suka nikmat megah bangun sedikit kalah oleh selfie kuasa tempat,melihat kemegahan borobudurketika dilokasi jangan NEG_kaget penuh sesak berselfie suka menikmati kemegahan bangunan sedikit terkalahkan oleh selfie menguasai tempat,lihat megah borobudurketika lokasi jangan NEG_kaget karena akan penuh sesak banyak orang berselfie bagi kita yang lebih suka nikmat megah bangun mungkin akan sedikit kalah oleh orang selfie yang akan akan kuasa tempat,lihat megah borobudurketika lokasi jangan NEG_kaget penuh sesak berselfie suka nikmat megah bangun sedikit kalah oleh selfie kuasa tempat,negatif,suasana
jangan khawatir buat yang tidak bawa setiap titik team photograpernya sendiri,jangan khawatir tidak bawa titik team photograpernya sendiri,jangan khawatir buat yang tidak bawa tiap titik team photograpernya sendiri,jangan khawatir tidak bawa titik team photograpernya sendiri,jangan_khawatir  tidak_bawa  titik team photograpernya sendiri,jangan_khawatir  buat yang tidak_bawa  tiap titik team photograpernya sendiri,jangan_khawatir  tidak_bawa  titik team photograpernya sendiri,jangan NEG_khawatir tidak NEG_bawa titik team photograpernya sendiri,jangan NEG_khawatir buat yang tidak NEG_bawa tiap titik team photograpernya sendiri,jangan NEG_khawatir tidak NEG_bawa titik team photograpernya sendiri,positif,fasilitas
jangan lewatkan untuk membeli souvenir akhir perjalanan kalau jogja lagi,jangan lewatkan membeli souvenir akhir perjalanan jogja,jangan lewat untuk beli souvenir akhir jalan kalau jogja lagi,jangan lewat beli souvenir akhir jalan jogja,jangan_lewatkan  membeli souvenir akhir perjalanan jogja,jangan_lewat  untuk beli souvenir akhir jalan kalau jogja lagi,jangan_lewat  beli souvenir akhir jalan jogja,jangan NEG_lewatkan membeli souvenir akhir perjalanan jogja,jangan NEG_lewat untuk beli souvenir akhir jalan kalau jogja lagi,jangan NEG_lewat beli souvenir akhir jalan jogja,positif,fasilitas
bila anda penggemar alam jangan lewatkan untuk melakukan kunjungan wisata vulkanik gunung merapi jogja suasana alam yang sangat indah sejuk,penggemar alam jangan lewatkan melakukan kunjungan wisata vulkanik gunung merapi jogja suasana alam indah sejuk,bila anda gemar alam jangan lewat untuk laku kunjung wisata vulkanik gunung rapi jogja suasana alam yang sangat indah sejuk,gemar alam jangan lewat laku kunjung wisata vulkanik gunung rapi jogja suasana alam indah sejuk,penggemar alam jangan_lewatkan  melakukan kunjungan wisata vulkanik gunung merapi jogja suasana alam indah sejuk,bila anda gemar alam jangan_lewat  untuk laku kunjung wisata vulkanik gunung rapi jogja suasana alam yang sangat indah sejuk,gemar alam jangan_lewat  laku kunjung wisata vulkanik gunung rapi jogja suasana alam indah sejuk,penggemar alam jangan NEG_lewatkan melakukan kunjungan wisata vulkanik gunung merapi jogja suasana alam indah sejuk,bila anda gemar alam jangan NEG_lewat untuk laku kunjung wisata vulkanik gunung rapi jogja suasana alam yang sangat indah sejuk,gemar alam jangan NEG_lewat laku kunjung wisata vulkanik gunung rapi jogja suasana alam indah sejuk,positif,suasana
jangan lupa bekali diri dengan kacamata hitam masker atau syal untuk menutupi hidung mulut dari vulkanik yang sangat tebal,jangan lupa bekali diri kacamata hitam masker syal menutupi hidung mulut vulkanik tebal,jangan lupa bekal diri dengan kacamata hitam masker atau syal untuk tutup hidung mulut dari vulkanik yang sangat tebal,jangan lupa bekal diri kacamata hitam masker syal tutup hidung mulut vulkanik tebal,jangan_lupa  bekali diri kacamata hitam masker syal menutupi hidung mulut vulkanik tebal,jangan_lupa  bekal diri dengan kacamata hitam masker atau syal untuk tutup hidung mulut dari vulkanik yang sangat tebal,jangan_lupa  bekal diri kacamata hitam masker syal tutup hidung mulut vulkanik tebal,jangan NEG_lupa bekali diri kacamata hitam masker syal menutupi hidung mulut vulkanik tebal,jangan NEG_lupa bekal diri dengan kacamata hitam masker atau syal untuk tutup hidung mulut dari vulkanik yang sangat tebal,jangan NEG_lupa bekal diri kacamata hitam masker syal tutup hidung mulut vulkanik tebal,negatif,serbaneka
sisi tebingnya batuan cukup tajam jadi jangan lupa pegangan tangan untuk yang sudah nikah,sisi tebingnya batuan cukup tajam jangan lupa pegangan tangan nikah,sisi tebing batu cukup tajam jadi jangan lupa pegang tangan untuk yang sudah nikah,sisi tebing batu cukup tajam jangan lupa pegang tangan nikah,sisi tebingnya batuan cukup tajam jangan_lupa  pegangan tangan nikah,sisi tebing batu cukup tajam jadi jangan_lupa  pegang tangan untuk yang sudah nikah,sisi tebing batu cukup tajam jangan_lupa  pegang tangan nikah,sisi tebingnya batuan cukup tajam jangan NEG_lupa pegangan tangan nikah,sisi tebing batu cukup tajam jadi jangan NEG_lupa pegang tangan untuk yang sudah nikah,sisi tebing batu cukup tajam jangan NEG_lupa pegang tangan nikah,negatif,lokasi
jangan lupa juga sering sering lihat jadwal penangkaran penyu saya anak kebagian ikut berpartisipasi melepas anak penyu pantai kuta,jangan lupa sering sering lihat jadwal penangkaran penyu anak kebagian ikut berpartisipasi melepas anak penyu pantai kuta,jangan lupa juga sering sering lihat jadwal tangkar penyu saya anak bagi ikut partisipasi lepas anak penyu pantai kuta,jangan lupa sering sering lihat jadwal tangkar penyu anak bagi ikut partisipasi lepas anak penyu pantai kuta,jangan_lupa  sering sering lihat jadwal penangkaran penyu anak kebagian ikut berpartisipasi melepas anak penyu pantai kuta,jangan_lupa  juga sering sering lihat jadwal tangkar penyu saya anak bagi ikut partisipasi lepas anak penyu pantai kuta,jangan_lupa  sering sering lihat jadwal tangkar penyu anak bagi ikut partisipasi lepas anak penyu pantai kuta,jangan NEG_lupa sering sering lihat jadwal penangkaran penyu anak kebagian ikut berpartisipasi melepas anak penyu pantai kuta,jangan NEG_lupa juga sering sering lihat jadwal tangkar penyu saya anak bagi ikut partisipasi lepas anak penyu pantai kuta,jangan NEG_lupa sering sering lihat jadwal tangkar penyu anak bagi ikut partisipasi lepas anak penyu pantai kuta,positif,serbaneka
buat yang bareng pacar atau orang yang disuka jogja jangan lupakan titik satu yang super instagramable,bareng pacar disuka jogja jangan lupakan titik satu super instagramable,buat yang bareng pacar atau orang yang suka jogja jangan lupa titik satu yang super instagramable,bareng pacar suka jogja jangan lupa titik satu super instagramable,bareng pacar disuka jogja jangan_lupakan  titik satu super instagramable,buat yang bareng pacar atau orang yang suka jogja jangan_lupa  titik satu yang super instagramable,bareng pacar suka jogja jangan_lupa  titik satu super instagramable,bareng pacar disuka jogja jangan NEG_lupakan titik satu super instagramable,buat yang bareng pacar atau orang yang suka jogja jangan NEG_lupa titik satu yang super instagramable,bareng pacar suka jogja jangan NEG_lupa titik satu super instagramable,positif,lokasi
jangan lupa berfoto,jangan lupa berfoto,jangan lupa foto,jangan lupa foto,jangan_lupa  berfoto,jangan_lupa  foto,jangan_lupa  foto,jangan NEG_lupa berfoto,jangan NEG_lupa foto,jangan NEG_lupa foto,positif,serbaneka
jangan lupa jaga kebersihan kalau berkunjung situ,jangan lupa jaga kebersihan berkunjung situ,jangan lupa jaga bersih kalau kunjung situ,jangan lupa jaga bersih kunjung situ,jangan_lupa  jaga kebersihan berkunjung situ,jangan_lupa  jaga bersih kalau kunjung situ,jangan_lupa  jaga bersih kunjung situ,jangan NEG_lupa jaga kebersihan berkunjung situ,jangan NEG_lupa jaga bersih kalau kunjung situ,jangan NEG_lupa jaga bersih kunjung situ,positif,serbaneka
jangan lupa jaket karena disini dingin angin kencang,jangan lupa jaket disini dingin angin kencang,jangan lupa jaket karena sini dingin angin kencang,jangan lupa jaket sini dingin angin kencang,jangan_lupa  jaket disini dingin angin kencang,jangan_lupa  jaket karena sini dingin angin kencang,jangan_lupa  jaket sini dingin angin kencang,jangan NEG_lupa jaket disini dingin angin kencang,jangan NEG_lupa jaket karena sini dingin angin kencang,jangan NEG_lupa jaket sini dingin angin kencang,positif,serbaneka
bila anda berencana pergi borobudur jangan lupa membawa payung atau topi,berencana pergi borobudur jangan lupa membawa payung topi,bila anda rencana pergi borobudur jangan lupa bawa payung atau topi,rencana pergi borobudur jangan lupa bawa payung topi,berencana pergi borobudur jangan_lupa  membawa payung topi,bila anda rencana pergi borobudur jangan_lupa  bawa payung atau topi,rencana pergi borobudur jangan_lupa  bawa payung topi,berencana pergi borobudur jangan NEG_lupa membawa payung topi,bila anda rencana pergi borobudur jangan NEG_lupa bawa payung atau topi,rencana pergi borobudur jangan NEG_lupa bawa payung topi,positif,serbaneka
jangan lupa menanyakan harga menawar,jangan lupa menanyakan harga menawar,jangan lupa tanya harga tawar,jangan lupa tanya harga tawar,jangan_lupa  menanyakan harga menawar,jangan_lupa  tanya harga tawar,jangan_lupa  tanya harga tawar,jangan NEG_lupa menanyakan harga menawar,jangan NEG_lupa tanya harga tawar,jangan NEG_lupa tanya harga tawar,positif,serbaneka
jangan lupa untuk berbekal minum dengan botol minum sendiri tidak menyampah sana,jangan lupa berbekal minum botol minum sendiri tidak menyampah,jangan lupa untuk bekal minum dengan botol minum sendiri tidak sampah sana,jangan lupa bekal minum botol minum sendiri tidak sampah,jangan_lupa  berbekal minum botol minum sendiri tidak_menyampah ,jangan_lupa  untuk bekal minum dengan botol minum sendiri tidak_sampah  sana,jangan_lupa  bekal minum botol minum sendiri tidak_sampah ,jangan NEG_lupa berbekal minum botol minum sendiri tidak NEG_menyampah,jangan NEG_lupa untuk bekal minum dengan botol minum sendiri tidak NEG_sampah sana,jangan NEG_lupa bekal minum botol minum sendiri tidak NEG_sampah,positif,serbaneka
jangan lupa bawa topi kalau siang hari,jangan lupa bawa topi siang hari,jangan lupa bawa topi kalau siang hari,jangan lupa bawa topi siang hari,jangan_lupa  bawa topi siang hari,jangan_lupa  bawa topi kalau siang hari,jangan_lupa  bawa topi siang hari,jangan NEG_lupa bawa topi siang hari,jangan NEG_lupa bawa topi kalau siang hari,jangan NEG_lupa bawa topi siang hari,positif,serbaneka
karenanya kalau liburan jangan musim hujan,karenanya liburan jangan musim hujan,karena kalau libur jangan musim hujan,karena libur jangan musim hujan,karenanya liburan jangan_musim  hujan,karena kalau libur jangan_musim  hujan,karena libur jangan_musim  hujan,karenanya liburan jangan NEG_musim hujan,karena kalau libur jangan NEG_musim hujan,karena libur jangan NEG_musim hujan,positif,serbaneka
jangan pergi saat musim kemarau atau diatas karena sangat panas biasakan bawa topi kacamata agar tidak kepanasan,jangan pergi musim kemarau diatas panas biasakan bawa topi kacamata tidak kepanasan,jangan pergi saat musim kemarau atau atas karena sangat panas biasa bawa topi kacamata agar tidak panas,jangan pergi musim kemarau atas panas biasa bawa topi kacamata tidak panas,jangan_pergi  musim kemarau diatas panas biasakan bawa topi kacamata tidak_kepanasan ,jangan_pergi  saat musim kemarau atau atas karena sangat panas biasa bawa topi kacamata agar tidak_panas ,jangan_pergi  musim kemarau atas panas biasa bawa topi kacamata tidak_panas ,jangan NEG_pergi musim kemarau diatas panas biasakan bawa topi kacamata tidak NEG_kepanasan,jangan NEG_pergi saat musim kemarau atau atas karena sangat panas biasa bawa topi kacamata agar tidak NEG_panas,jangan NEG_pergi musim kemarau atas panas biasa bawa topi kacamata tidak NEG_panas,negatif,serbaneka
jangan ragu untuk minta tolong difotokan oleh pengemudi karena mereka akan sangat senang untuk membantu,jangan ragu minta tolong difotokan oleh pengemudi mereka senang membantu,jangan ragu untuk minta tolong foto oleh kemudi karena mereka akan sangat senang untuk bantu,jangan ragu minta tolong foto oleh kemudi mereka senang bantu,jangan_ragu  minta tolong difotokan oleh pengemudi mereka senang membantu,jangan_ragu  untuk minta tolong foto oleh kemudi karena mereka akan sangat senang untuk bantu,jangan_ragu  minta tolong foto oleh kemudi mereka senang bantu,jangan NEG_ragu minta tolong difotokan oleh pengemudi mereka senang membantu,jangan NEG_ragu untuk minta tolong foto oleh kemudi karena mereka akan sangat senang untuk bantu,jangan NEG_ragu minta tolong foto oleh kemudi mereka senang bantu,positif,fasilitas
jalanan menuju kesini penuh perjuangan liku liku sebaiknya kalau kemari pagi jangan terlalu siang karena panas,jalanan menuju kesini penuh perjuangan liku liku sebaiknya kemari pagi jangan siang panas,jalan tuju kesini penuh juang liku liku baik kalau kemari pagi jangan terlalu siang karena panas,jalan tuju kesini penuh juang liku liku baik kemari pagi jangan siang panas,jalanan menuju kesini penuh perjuangan liku liku sebaiknya kemari pagi jangan_siang  panas,jalan tuju kesini penuh juang liku liku baik kalau kemari pagi jangan_terlalu  siang karena panas,jalan tuju kesini penuh juang liku liku baik kemari pagi jangan_siang  panas,jalanan menuju kesini penuh perjuangan liku liku sebaiknya kemari pagi jangan NEG_siang panas,jalan tuju kesini penuh juang liku liku baik kalau kemari pagi jangan NEG_terlalu siang karena panas,jalan tuju kesini penuh juang liku liku baik kemari pagi jangan NEG_siang panas,negatif,lokasi
yang main jogja yang dari luar kota jangan sampai tidak mampir berkunjung candi borobudur candi yang menjadi salah satu objek keajaiban dunia menjadi pilihan wisata,main jogja luar kota jangan tidak mampir berkunjung candi borobudur candi satu objek keajaiban dunia pilihan wisata,yang main jogja yang dari luar kota jangan sampai tidak mampir kunjung candi borobudur candi yang jadi salah satu objek ajaib dunia jadi pilih wisata,main jogja luar kota jangan tidak mampir kunjung candi borobudur candi satu objek ajaib dunia pilih wisata,main jogja luar kota jangan_tidak  mampir berkunjung candi borobudur candi satu objek keajaiban dunia pilihan wisata,yang main jogja yang dari luar kota jangan_sampai  tidak_mampir  kunjung candi borobudur candi yang jadi salah satu objek ajaib dunia jadi pilih wisata,main jogja luar kota jangan_tidak  mampir kunjung candi borobudur candi satu objek ajaib dunia pilih wisata,main jogja luar kota jangan NEG_tidak mampir berkunjung candi borobudur candi satu objek keajaiban dunia pilihan wisata,yang main jogja yang dari luar kota jangan NEG_sampai tidak NEG_mampir kunjung candi borobudur candi yang jadi salah satu objek ajaib dunia jadi pilih wisata,main jogja luar kota jangan NEG_tidak mampir kunjung candi borobudur candi satu objek ajaib dunia pilih wisata,positif,serbaneka
jika kalian main jogja rasanya kurang afdol jika tidak mampir museum,kalian main jogja rasanya kurang afdol tidak mampir museum,jika kalian main jogja rasa kurang afdol jika tidak mampir museum,kalian main jogja rasa kurang afdol tidak mampir museum,kalian main jogja rasanya kurang_afdol  tidak_mampir  museum,jika kalian main jogja rasa kurang_afdol  jika tidak_mampir  museum,kalian main jogja rasa kurang_afdol  tidak_mampir  museum,kalian main jogja rasanya kurang NEG_afdol tidak NEG_mampir museum,jika kalian main jogja rasa kurang NEG_afdol jika tidak NEG_mampir museum,kalian main jogja rasa kurang NEG_afdol tidak NEG_mampir museum,positif,serbaneka
memang terdapat kekurangan pada banyaknya pedagang yang menawarkan barang dengan cukup memaksa,kekurangan banyaknya pedagang menawarkan barang cukup memaksa,memang dapat kurang pada banyak dagang yang tawar barang dengan cukup paksa,kurang banyak dagang tawar barang cukup paksa,kekurangan banyaknya pedagang menawarkan barang cukup memaksa,memang dapat kurang_pada  banyak dagang yang tawar barang dengan cukup paksa,kurang_banyak  dagang tawar barang cukup paksa,kekurangan banyaknya pedagang menawarkan barang cukup memaksa,memang dapat kurang NEG_pada banyak dagang yang tawar barang dengan cukup paksa,kurang NEG_banyak dagang tawar barang cukup paksa,negatif,fasilitas
candi terletak kurang lebih kamu sebelah barat daya semarang kamu sebelah barat surakarta kamu sebelah barat laut yogyakarta,candi terletak kurang sebelah barat daya semarang sebelah barat surakarta sebelah barat laut yogyakarta,candi letak kurang lebih kamu belah barat daya semarang kamu belah barat surakarta kamu belah barat laut yogyakarta,candi letak kurang belah barat daya semarang belah barat surakarta belah barat laut yogyakarta,candi terletak kurang_sebelah  barat daya semarang sebelah barat surakarta sebelah barat laut yogyakarta,candi letak kurang_lebih  kamu belah barat daya semarang kamu belah barat surakarta kamu belah barat laut yogyakarta,candi letak kurang_belah  barat daya semarang belah barat surakarta belah barat laut yogyakarta,candi terletak kurang NEG_sebelah barat daya semarang sebelah barat surakarta sebelah barat laut yogyakarta,candi letak kurang NEG_lebih kamu belah barat daya semarang kamu belah barat surakarta kamu belah barat laut yogyakarta,candi letak kurang NEG_belah barat daya semarang belah barat surakarta belah barat laut yogyakarta,positif,lokasi
tidak mengurangi kekaguman saya terhadap nenek moyang yang dengan peralatan seadanya mampu membuat candi semegah,tidak mengurangi kekaguman terhadap nenek moyang peralatan seadanya mampu membuat candi semegah,tidak kurang kagum saya hadap nenek moyang yang dengan alat ada mampu buat candi megah,tidak kurang kagum hadap nenek moyang alat ada mampu buat candi megah,tidak_mengurangi  kekaguman terhadap nenek moyang peralatan seadanya mampu membuat candi semegah,tidak_kurang  kagum saya hadap nenek moyang yang dengan alat ada mampu buat candi megah,tidak_kurang  kagum hadap nenek moyang alat ada mampu buat candi megah,tidak NEG_mengurangi kekaguman terhadap nenek moyang peralatan seadanya mampu membuat candi semegah,tidak NEG_kurang kagum saya hadap nenek moyang yang dengan alat ada mampu buat candi megah,tidak NEG_kurang kagum hadap nenek moyang alat ada mampu buat candi megah,positif,lokasi
disana kita akan dibawa berkeliling merapi kurang lebih lokasi yang akan dikunjungi bungker batu alien museum merapi,disana dibawa berkeliling merapi kurang lokasi dikunjungi bungker batu alien museum merapi,sana kita akan bawa keliling rapi kurang lebih lokasi yang akan kunjung bungker batu alien museum rapi,sana bawa keliling rapi kurang lokasi kunjung bungker batu alien museum rapi,disana dibawa berkeliling merapi kurang_lokasi  dikunjungi bungker batu alien museum merapi,sana kita akan bawa keliling rapi kurang_lebih  lokasi yang akan kunjung bungker batu alien museum rapi,sana bawa keliling rapi kurang_lokasi  kunjung bungker batu alien museum rapi,disana dibawa berkeliling merapi kurang NEG_lokasi dikunjungi bungker batu alien museum merapi,sana kita akan bawa keliling rapi kurang NEG_lebih lokasi yang akan kunjung bungker batu alien museum rapi,sana bawa keliling rapi kurang NEG_lokasi kunjung bungker batu alien museum rapi,positif,lokasi
dengan rupiah kami mendapatkan wisata museum selama kurang lebih menit dipandu oleh pemandu yang akan bercerita tentang museum,rupiah mendapatkan wisata museum kurang menit dipandu oleh pemandu bercerita tentang museum,dengan rupiah kami dapat wisata museum lama kurang lebih menit pandu oleh pandu yang akan cerita tentang museum,rupiah dapat wisata museum kurang menit pandu oleh pandu cerita tentang museum,rupiah mendapatkan wisata museum kurang_menit  dipandu oleh pemandu bercerita tentang museum,dengan rupiah kami dapat wisata museum lama kurang_lebih  menit pandu oleh pandu yang akan cerita tentang museum,rupiah dapat wisata museum kurang_menit  pandu oleh pandu cerita tentang museum,rupiah mendapatkan wisata museum kurang NEG_menit dipandu oleh pemandu bercerita tentang museum,dengan rupiah kami dapat wisata museum lama kurang NEG_lebih menit pandu oleh pandu yang akan cerita tentang museum,rupiah dapat wisata museum kurang NEG_menit pandu oleh pandu cerita tentang museum,positif,fasilitas
pantai kuta sekarang sudah berkurang peminatnya karena memang sudah terlalu mainstream,pantai kuta sekarang berkurang peminatnya mainstream,pantai kuta sekarang sudah kurang minat karena memang sudah terlalu mainstream,pantai kuta sekarang kurang minat mainstream,pantai kuta sekarang berkurang peminatnya mainstream,pantai kuta sekarang sudah kurang_minat  karena memang sudah terlalu mainstream,pantai kuta sekarang kurang_minat  mainstream,pantai kuta sekarang berkurang peminatnya mainstream,pantai kuta sekarang sudah kurang NEG_minat karena memang sudah terlalu mainstream,pantai kuta sekarang kurang NEG_minat mainstream,negatif,serbaneka
