Review_Bersih,Review_Stopwords,Review_Stemming,Review_Stop_Stem,Review_Stop_Joined,Review_Stem_Joined,Review_Stop_Stem_Joined,Review_Stop_Neg,Review_Stem_Neg,Review_Stop_Stem_Neg,Sentibar,Aspbar
sayangnya hanya bisa berfoto atas telapak tangan raksasa,sayangnya berfoto atas telapak tangan raksasa,sayang hanya bisa foto atas telapak tangan raksasa,sayang foto atas telapak tangan raksasa,sayangnya berfoto atas telapak tangan raksasa,sayang hanya bisa foto atas telapak tangan raksasa,sayang foto atas telapak tangan raksasa,sayangnya berfoto atas telapak tangan raksasa,sayang hanya bisa foto atas telapak tangan raksasa,sayang foto atas telapak tangan raksasa,negatif,serbaneka
akses pantai kuta sudah ditutup total untuk kendaraan bermotor,akses pantai kuta ditutup total kendaraan bermotor,akses pantai kuta sudah tutup total untuk kendara motor,akses pantai kuta tutup total kendara motor,akses pantai kuta ditutup total kendaraan bermotor,akses pantai kuta sudah tutup total untuk kendara motor,akses pantai kuta tutup total kendara motor,akses pantai kuta ditutup total kendaraan bermotor,akses pantai kuta sudah tutup total untuk kendara motor,akses pantai kuta tutup total kendara motor,negatif,fasilitas
waktu wisata selama menit rasanya masih kurang buat saya,waktu wisata menit rasanya kurang,waktu wisata lama menit rasa masih kurang buat saya,waktu wisata menit rasa kurang,waktu wisata menit rasanya ,waktu wisata lama menit rasa masih kurang_buat  saya,waktu wisata menit rasa ,waktu wisata menit rasanya kurang,waktu wisata lama menit rasa masih kurang NEG_buat saya,waktu wisata menit rasa kurang,negatif,fasilitas
dalam jangka waktu tertentu tempat rutin dibersihkan dari lumut,jangka waktu tempat rutin dibersihkan lumut,dalam jangka waktu tentu tempat rutin bersih dari lumut,jangka waktu tempat rutin bersih lumut,jangka waktu tempat rutin dibersihkan lumut,dalam jangka waktu tentu tempat rutin bersih dari lumut,jangka waktu tempat rutin bersih lumut,jangka waktu tempat rutin dibersihkan lumut,dalam jangka waktu tentu tempat rutin bersih dari lumut,jangka waktu tempat rutin bersih lumut,positif,fasilitas
datang hujan begitu masuk langsung sewa andhong buat mengantar gerbang candi,datang hujan masuk langsung sewa andhong mengantar gerbang candi,datang hujan begitu masuk langsung sewa andhong buat antar gerbang candi,datang hujan masuk langsung sewa andhong antar gerbang candi,datang hujan masuk langsung sewa andhong mengantar gerbang candi,datang hujan begitu masuk langsung sewa andhong buat antar gerbang candi,datang hujan masuk langsung sewa andhong antar gerbang candi,datang hujan masuk langsung sewa andhong mengantar gerbang candi,datang hujan begitu masuk langsung sewa andhong buat antar gerbang candi,datang hujan masuk langsung sewa andhong antar gerbang candi,positif,fasilitas
begitu turun langsung sewa payung,turun langsung sewa payung,begitu turun langsung sewa payung,turun langsung sewa payung,turun langsung sewa payung,begitu turun langsung sewa payung,turun langsung sewa payung,turun langsung sewa payung,begitu turun langsung sewa payung,turun langsung sewa payung,positif,fasilitas
untuk menuju candi borobodur kita bisa memakai kereta kereta kuda mobil golf dimana kita harus membeli tiket kendaraannya loket dalam area candi,menuju candi borobodur memakai kereta kereta kuda mobil golf dimana membeli tiket kendaraannya loket area candi,untuk tuju candi borobodur kita bisa pakai kereta kereta kuda mobil golf mana kita harus beli tiket kendara loket dalam area candi,tuju candi borobodur pakai kereta kereta kuda mobil golf mana beli tiket kendara loket area candi,menuju candi borobodur memakai kereta kereta kuda mobil golf dimana membeli tiket kendaraannya loket area candi,untuk tuju candi borobodur kita bisa pakai kereta kereta kuda mobil golf mana kita harus beli tiket kendara loket dalam area candi,tuju candi borobodur pakai kereta kereta kuda mobil golf mana beli tiket kendara loket area candi,menuju candi borobodur memakai kereta kereta kuda mobil golf dimana membeli tiket kendaraannya loket area candi,untuk tuju candi borobodur kita bisa pakai kereta kereta kuda mobil golf mana kita harus beli tiket kendara loket dalam area candi,tuju candi borobodur pakai kereta kereta kuda mobil golf mana beli tiket kendara loket area candi,positif,fasilitas
kami memilih menaiki kereta kuda merupakan pilihan yang tepat karena menikmati angin sepoi sepoi sambil naik kereta kuda kusirnya sangat responsif,memilih menaiki kereta kuda merupakan pilihan tepat menikmati angin sepoi sepoi naik kereta kuda kusirnya responsif,kami pilih naik kereta kuda rupa pilih yang tepat karena nikmat angin sepoi sepoi sambil naik kereta kuda kusir sangat responsif,pilih naik kereta kuda rupa pilih tepat nikmat angin sepoi sepoi naik kereta kuda kusir responsif,memilih menaiki kereta kuda merupakan pilihan tepat menikmati angin sepoi sepoi naik kereta kuda kusirnya responsif,kami pilih naik kereta kuda rupa pilih yang tepat karena nikmat angin sepoi sepoi sambil naik kereta kuda kusir sangat responsif,pilih naik kereta kuda rupa pilih tepat nikmat angin sepoi sepoi naik kereta kuda kusir responsif,memilih menaiki kereta kuda merupakan pilihan tepat menikmati angin sepoi sepoi naik kereta kuda kusirnya responsif,kami pilih naik kereta kuda rupa pilih yang tepat karena nikmat angin sepoi sepoi sambil naik kereta kuda kusir sangat responsif,pilih naik kereta kuda rupa pilih tepat nikmat angin sepoi sepoi naik kereta kuda kusir responsif,positif,fasilitas
beliau menyarankan tempat tempat yang bagus untuk mengambil foto dengan latar belakang candi borobudur beliau yang mengambil fotonya,beliau menyarankan tempat tempat bagus mengambil foto latar belakang candi borobudur beliau mengambil fotonya,beliau saran tempat tempat yang bagus untuk ambil foto dengan latar belakang candi borobudur beliau yang ambil foto,beliau saran tempat tempat bagus ambil foto latar belakang candi borobudur beliau ambil foto,beliau menyarankan tempat tempat bagus mengambil foto latar belakang candi borobudur beliau mengambil fotonya,beliau saran tempat tempat yang bagus untuk ambil foto dengan latar belakang candi borobudur beliau yang ambil foto,beliau saran tempat tempat bagus ambil foto latar belakang candi borobudur beliau ambil foto,beliau menyarankan tempat tempat bagus mengambil foto latar belakang candi borobudur beliau mengambil fotonya,beliau saran tempat tempat yang bagus untuk ambil foto dengan latar belakang candi borobudur beliau yang ambil foto,beliau saran tempat tempat bagus ambil foto latar belakang candi borobudur beliau ambil foto,positif,fasilitas
mulai dari pintu masuk sudah fasilitas toilet mushola sebelum kita berjalan candinya,mulai pintu masuk fasilitas toilet mushola berjalan candinya,mulai dari pintu masuk sudah fasilitas toilet mushola belum kita jalan candi,mulai pintu masuk fasilitas toilet mushola jalan candi,mulai pintu masuk fasilitas toilet mushola berjalan candinya,mulai dari pintu masuk sudah fasilitas toilet mushola belum kita jalan candi,mulai pintu masuk fasilitas toilet mushola jalan candi,mulai pintu masuk fasilitas toilet mushola berjalan candinya,mulai dari pintu masuk sudah fasilitas toilet mushola belum kita jalan candi,mulai pintu masuk fasilitas toilet mushola jalan candi,positif,fasilitas
setelah kita foto foto akhirnya memutuskan untuk menuju pintu keluar disitu mushola juga,foto foto akhirnya memutuskan menuju pintu keluar disitu mushola,telah kita foto foto akhir putus untuk tuju pintu keluar situ mushola juga,foto foto akhir putus tuju pintu keluar situ mushola,foto foto akhirnya memutuskan menuju pintu keluar disitu mushola,telah kita foto foto akhir putus untuk tuju pintu keluar situ mushola juga,foto foto akhir putus tuju pintu keluar situ mushola,foto foto akhirnya memutuskan menuju pintu keluar disitu mushola,telah kita foto foto akhir putus untuk tuju pintu keluar situ mushola juga,foto foto akhir putus tuju pintu keluar situ mushola,positif,fasilitas
sambil menuju pintu keluar terdapat pedagang yang banyak banget,menuju pintu keluar pedagang banget,sambil tuju pintu keluar dapat dagang yang banyak banget,tuju pintu keluar dagang banget,menuju pintu keluar pedagang banget,sambil tuju pintu keluar dapat dagang yang banyak banget,tuju pintu keluar dagang banget,menuju pintu keluar pedagang banget,sambil tuju pintu keluar dapat dagang yang banyak banget,tuju pintu keluar dagang banget,positif,fasilitas
bisa memilih oleh oleh yang cocok untuk keluarga,memilih oleh oleh cocok keluarga,bisa pilih oleh oleh yang cocok untuk keluarga,pilih oleh oleh cocok keluarga,memilih oleh oleh cocok keluarga,bisa pilih oleh oleh yang cocok untuk keluarga,pilih oleh oleh cocok keluarga,memilih oleh oleh cocok keluarga,bisa pilih oleh oleh yang cocok untuk keluarga,pilih oleh oleh cocok keluarga,positif,fasilitas
banyak juga terdapat tempat suvenir untuk dibawa sebagai oleh oleh,tempat suvenir dibawa oleh oleh,banyak juga dapat tempat suvenir untuk bawa bagai oleh oleh,tempat suvenir bawa oleh oleh,tempat suvenir dibawa oleh oleh,banyak juga dapat tempat suvenir untuk bawa bagai oleh oleh,tempat suvenir bawa oleh oleh,tempat suvenir dibawa oleh oleh,banyak juga dapat tempat suvenir untuk bawa bagai oleh oleh,tempat suvenir bawa oleh oleh,positif,fasilitas
jika anda benar benar tertarik dengan sejarah belakang monumen menarik anda dapat dengan mudah menyewa pemandu wisata,benar benar tertarik sejarah belakang monumen menarik mudah menyewa pemandu wisata,jika anda benar benar tarik dengan sejarah belakang monumen tarik anda dapat dengan mudah sewa pandu wisata,benar benar tarik sejarah belakang monumen tarik mudah sewa pandu wisata,benar benar tertarik sejarah belakang monumen menarik mudah menyewa pemandu wisata,jika anda benar benar tarik dengan sejarah belakang monumen tarik anda dapat dengan mudah sewa pandu wisata,benar benar tarik sejarah belakang monumen tarik mudah sewa pandu wisata,benar benar tertarik sejarah belakang monumen menarik mudah menyewa pemandu wisata,jika anda benar benar tarik dengan sejarah belakang monumen tarik anda dapat dengan mudah sewa pandu wisata,benar benar tarik sejarah belakang monumen tarik mudah sewa pandu wisata,positif,fasilitas
dengan jarak yang cukup jauh dari pintu masuk hingga kawasan candi tentu sangat menguras tenaga ,jarak cukup jauh pintu masuk kawasan candi tentu menguras tenaga,dengan jarak yang cukup jauh dari pintu masuk hingga kawasan candi tentu sangat uras tenaga,jarak cukup jauh pintu masuk kawasan candi tentu uras tenaga,jarak cukup jauh pintu masuk kawasan candi tentu menguras tenaga,dengan jarak yang cukup jauh dari pintu masuk hingga kawasan candi tentu sangat uras tenaga,jarak cukup jauh pintu masuk kawasan candi tentu uras tenaga,jarak cukup jauh pintu masuk kawasan candi tentu menguras tenaga,dengan jarak yang cukup jauh dari pintu masuk hingga kawasan candi tentu sangat uras tenaga,jarak cukup jauh pintu masuk kawasan candi tentu uras tenaga,negatif,lokasi
pintu masuk keluar banyak warga lokal yang mencoba untuk menjual souvenir dari shirt untuk patung miniatur kuil buddha banyak lagi,pintu masuk keluar warga lokal mencoba menjual souvenir shirt patung miniatur kuil buddha,pintu masuk keluar banyak warga lokal yang coba untuk jual souvenir dari shirt untuk patung miniatur kuil buddha banyak lagi,pintu masuk keluar warga lokal coba jual souvenir shirt patung miniatur kuil buddha,pintu masuk keluar warga lokal mencoba menjual souvenir shirt patung miniatur kuil buddha,pintu masuk keluar banyak warga lokal yang coba untuk jual souvenir dari shirt untuk patung miniatur kuil buddha banyak lagi,pintu masuk keluar warga lokal coba jual souvenir shirt patung miniatur kuil buddha,pintu masuk keluar warga lokal mencoba menjual souvenir shirt patung miniatur kuil buddha,pintu masuk keluar banyak warga lokal yang coba untuk jual souvenir dari shirt untuk patung miniatur kuil buddha banyak lagi,pintu masuk keluar warga lokal coba jual souvenir shirt patung miniatur kuil buddha,positif,fasilitas
pada akhirnya mereka mungkin akan lebih murah daripada yang dari kota malioboro,akhirnya mereka murah daripada kota malioboro,pada akhir mereka mungkin akan lebih murah daripada yang dari kota malioboro,akhir mereka murah daripada kota malioboro,akhirnya mereka murah daripada kota malioboro,pada akhir mereka mungkin akan lebih murah daripada yang dari kota malioboro,akhir mereka murah daripada kota malioboro,akhirnya mereka murah daripada kota malioboro,pada akhir mereka mungkin akan lebih murah daripada yang dari kota malioboro,akhir mereka murah daripada kota malioboro,positif,fasilitas
disana juga disediakan kursi roda gratis buat orang,disana disediakan kursi roda gratis,sana juga sedia kursi roda gratis buat orang,sana sedia kursi roda gratis,disana disediakan kursi roda gratis,sana juga sedia kursi roda gratis buat orang,sana sedia kursi roda gratis,disana disediakan kursi roda gratis,sana juga sedia kursi roda gratis buat orang,sana sedia kursi roda gratis,positif,fasilitas
karena jalanan menanjak kita bisa meminta bantuan dengan orang orang sekitaran tentunya dengan membayar kepada mereka jasa mendorong kursi roda,jalanan menanjak meminta bantuan sekitaran tentunya membayar kepada mereka jasa mendorong kursi roda,karena jalan tanjak kita bisa minta bantu dengan orang orang sekitar tentu dengan bayar kepada mereka jasa dorong kursi roda,jalan tanjak minta bantu sekitar tentu bayar kepada mereka jasa dorong kursi roda,jalanan menanjak meminta bantuan sekitaran tentunya membayar kepada mereka jasa mendorong kursi roda,karena jalan tanjak kita bisa minta bantu dengan orang orang sekitar tentu dengan bayar kepada mereka jasa dorong kursi roda,jalan tanjak minta bantu sekitar tentu bayar kepada mereka jasa dorong kursi roda,jalanan menanjak meminta bantuan sekitaran tentunya membayar kepada mereka jasa mendorong kursi roda,karena jalan tanjak kita bisa minta bantu dengan orang orang sekitar tentu dengan bayar kepada mereka jasa dorong kursi roda,jalan tanjak minta bantu sekitar tentu bayar kepada mereka jasa dorong kursi roda,positif,fasilitas
kita juga bisa membeli tiket terusan seperti tiket terusan borobudur prambanan atau borobudur ratu boko,membeli tiket terusan tiket terusan borobudur prambanan borobudur ratu boko,kita juga bisa beli tiket terus seperti tiket terus borobudur prambanan atau borobudur ratu boko,beli tiket terus tiket terus borobudur prambanan borobudur ratu boko,membeli tiket terusan tiket terusan borobudur prambanan borobudur ratu boko,kita juga bisa beli tiket terus seperti tiket terus borobudur prambanan atau borobudur ratu boko,beli tiket terus tiket terus borobudur prambanan borobudur ratu boko,membeli tiket terusan tiket terusan borobudur prambanan borobudur ratu boko,kita juga bisa beli tiket terus seperti tiket terus borobudur prambanan atau borobudur ratu boko,beli tiket terus tiket terus borobudur prambanan borobudur ratu boko,positif,fasilitas
juga beberapa permainan sekitarnya seperti airboard atau sekedar berfoto menggunakan busana jawa,permainan sekitarnya airboard sekedar berfoto menggunakan busana jawa,juga beberapa main sekitar seperti airboard atau dar foto guna busana jawa,main sekitar airboard dar foto guna busana jawa,permainan sekitarnya airboard sekedar berfoto menggunakan busana jawa,juga beberapa main sekitar seperti airboard atau dar foto guna busana jawa,main sekitar airboard dar foto guna busana jawa,permainan sekitarnya airboard sekedar berfoto menggunakan busana jawa,juga beberapa main sekitar seperti airboard atau dar foto guna busana jawa,main sekitar airboard dar foto guna busana jawa,positif,fasilitas
selain wisata candi pula museum pasar cenderamata,wisata candi museum pasar cenderamata,selain wisata candi pula museum pasar cenderamata,wisata candi museum pasar cenderamata,wisata candi museum pasar cenderamata,selain wisata candi pula museum pasar cenderamata,wisata candi museum pasar cenderamata,wisata candi museum pasar cenderamata,selain wisata candi pula museum pasar cenderamata,wisata candi museum pasar cenderamata,positif,fasilitas
fasilitas memadai toko oleh oleh tersedia,fasilitas memadai toko oleh oleh tersedia,fasilitas pada toko oleh oleh sedia,fasilitas pada toko oleh oleh sedia,fasilitas memadai toko oleh oleh tersedia,fasilitas pada toko oleh oleh sedia,fasilitas pada toko oleh oleh sedia,fasilitas memadai toko oleh oleh tersedia,fasilitas pada toko oleh oleh sedia,fasilitas pada toko oleh oleh sedia,positif,fasilitas
harga sewa payung parkiran sebesar rupiah,harga sewa payung parkiran sebesar rupiah,harga sewa payung parkir besar rupiah,harga sewa payung parkir besar rupiah,harga sewa payung parkiran sebesar rupiah,harga sewa payung parkir besar rupiah,harga sewa payung parkir besar rupiah,harga sewa payung parkiran sebesar rupiah,harga sewa payung parkir besar rupiah,harga sewa payung parkir besar rupiah,positif,fasilitas
dalam anda bisa dapatkan seharga rupiah,dapatkan seharga rupiah,dalam anda bisa dapat harga rupiah,dapat harga rupiah,dapatkan seharga rupiah,dalam anda bisa dapat harga rupiah,dapat harga rupiah,dapatkan seharga rupiah,dalam anda bisa dapat harga rupiah,dapat harga rupiah,positif,fasilitas
dekat arah menuju keluar terdapat mobil safari yang bisa anda gunakan dengan membayar rupiah anda akan dibawa kearea parkir dengan melewati kampung wisata dapat mampir beberapa tempat salah satunya peternakan lebah madu,dekat arah menuju keluar mobil safari gunakan membayar rupiah dibawa kearea parkir melewati kampung wisata mampir tempat satunya peternakan lebah madu,dekat arah tuju keluar dapat mobil safari yang bisa anda guna dengan bayar rupiah anda akan bawa area parkir dengan lewat kampung wisata dapat mampir beberapa tempat salah satu terna lebah madu,dekat arah tuju keluar mobil safari guna bayar rupiah bawa area parkir lewat kampung wisata mampir tempat satu terna lebah madu,dekat arah menuju keluar mobil safari gunakan membayar rupiah dibawa kearea parkir melewati kampung wisata mampir tempat satunya peternakan lebah madu,dekat arah tuju keluar dapat mobil safari yang bisa anda guna dengan bayar rupiah anda akan bawa area parkir dengan lewat kampung wisata dapat mampir beberapa tempat salah satu terna lebah madu,dekat arah tuju keluar mobil safari guna bayar rupiah bawa area parkir lewat kampung wisata mampir tempat satu terna lebah madu,dekat arah menuju keluar mobil safari gunakan membayar rupiah dibawa kearea parkir melewati kampung wisata mampir tempat satunya peternakan lebah madu,dekat arah tuju keluar dapat mobil safari yang bisa anda guna dengan bayar rupiah anda akan bawa area parkir dengan lewat kampung wisata dapat mampir beberapa tempat salah satu terna lebah madu,dekat arah tuju keluar mobil safari guna bayar rupiah bawa area parkir lewat kampung wisata mampir tempat satu terna lebah madu,positif,fasilitas
pintu keluar banyak pedagang pedagang batik cinderamata camilan khas jawa tengah,pintu keluar pedagang pedagang batik cinderamata camilan khas jawa tengah,pintu keluar banyak dagang dagang batik cinderamata camil khas jawa tengah,pintu keluar dagang dagang batik cinderamata camil khas jawa tengah,pintu keluar pedagang pedagang batik cinderamata camilan khas jawa tengah,pintu keluar banyak dagang dagang batik cinderamata camil khas jawa tengah,pintu keluar dagang dagang batik cinderamata camil khas jawa tengah,pintu keluar pedagang pedagang batik cinderamata camilan khas jawa tengah,pintu keluar banyak dagang dagang batik cinderamata camil khas jawa tengah,pintu keluar dagang dagang batik cinderamata camil khas jawa tengah,positif,fasilitas
ramai sekali musim liburan anak sekolah untungnya masih bisa dapat titik buat foto foto,ramai musim liburan anak sekolah untungnya titik foto foto,ramai sekali musim libur anak sekolah untung masih bisa dapat titik buat foto foto,ramai musim libur anak sekolah untung titik foto foto,ramai musim liburan anak sekolah untungnya titik foto foto,ramai sekali musim libur anak sekolah untung masih bisa dapat titik buat foto foto,ramai musim libur anak sekolah untung titik foto foto,ramai musim liburan anak sekolah untungnya titik foto foto,ramai sekali musim libur anak sekolah untung masih bisa dapat titik buat foto foto,ramai musim libur anak sekolah untung titik foto foto,positif,suasana
dapat menggunakan pembayaran tunai tunai anda akan bebas berfoto foto didalamnya tersedia juga tempat makannan khas jogjakarta,menggunakan pembayaran tunai tunai bebas berfoto foto didalamnya tersedia tempat makannan khas jogjakarta,dapat guna bayar tunai tunai anda akan bebas foto foto dalam sedia juga tempat makannan khas jogjakarta,guna bayar tunai tunai bebas foto foto dalam sedia tempat makannan khas jogjakarta,menggunakan pembayaran tunai tunai bebas berfoto foto didalamnya tersedia tempat makannan khas jogjakarta,dapat guna bayar tunai tunai anda akan bebas foto foto dalam sedia juga tempat makannan khas jogjakarta,guna bayar tunai tunai bebas foto foto dalam sedia tempat makannan khas jogjakarta,menggunakan pembayaran tunai tunai bebas berfoto foto didalamnya tersedia tempat makannan khas jogjakarta,dapat guna bayar tunai tunai anda akan bebas foto foto dalam sedia juga tempat makannan khas jogjakarta,guna bayar tunai tunai bebas foto foto dalam sedia tempat makannan khas jogjakarta,positif,fasilitas
mencoba wisata mengelilingi desa sekita menggunakan safari juga merupakan pilihan yang baik harga sangat terjangkau,mencoba wisata mengelilingi desa sekita menggunakan safari merupakan pilihan baik harga terjangkau,coba wisata keliling desa kita guna safari juga rupa pilih yang baik harga sangat jangkau,coba wisata keliling desa kita guna safari rupa pilih baik harga jangkau,mencoba wisata mengelilingi desa sekita menggunakan safari merupakan pilihan baik harga terjangkau,coba wisata keliling desa kita guna safari juga rupa pilih yang baik harga sangat jangkau,coba wisata keliling desa kita guna safari rupa pilih baik harga jangkau,mencoba wisata mengelilingi desa sekita menggunakan safari merupakan pilihan baik harga terjangkau,coba wisata keliling desa kita guna safari juga rupa pilih yang baik harga sangat jangkau,coba wisata keliling desa kita guna safari rupa pilih baik harga jangkau,positif,fasilitas
sewa mobil,sewa mobil,sewa mobil,sewa mobil,sewa mobil,sewa mobil,sewa mobil,sewa mobil,sewa mobil,sewa mobil,positif,fasilitas
bagi para anak anak akan sangat menarik untuk menjelajahi sejarah kerajaan jawa khususnya yogya solo,para anak anak menarik menjelajahi sejarah kerajaan jawa khususnya yogya solo,bagi para anak anak akan sangat tarik untuk jajah sejarah raja jawa khusus yogya solo,para anak anak tarik jajah sejarah raja jawa khusus yogya solo,para anak anak menarik menjelajahi sejarah kerajaan jawa khususnya yogya solo,bagi para anak anak akan sangat tarik untuk jajah sejarah raja jawa khusus yogya solo,para anak anak tarik jajah sejarah raja jawa khusus yogya solo,para anak anak menarik menjelajahi sejarah kerajaan jawa khususnya yogya solo,bagi para anak anak akan sangat tarik untuk jajah sejarah raja jawa khusus yogya solo,para anak anak tarik jajah sejarah raja jawa khusus yogya solo,positif,serbaneka
harga ribu bisa mutar keliling sekitar kampung borobudur,harga ribu mutar keliling sekitar kampung borobudur,harga ribu bisa mutar keliling sekitar kampung borobudur,harga ribu mutar keliling sekitar kampung borobudur,harga ribu mutar keliling sekitar kampung borobudur,harga ribu bisa mutar keliling sekitar kampung borobudur,harga ribu mutar keliling sekitar kampung borobudur,harga ribu mutar keliling sekitar kampung borobudur,harga ribu bisa mutar keliling sekitar kampung borobudur,harga ribu mutar keliling sekitar kampung borobudur,positif,fasilitas
diantar lagi pelataran parkir candi,diantar pelataran parkir candi,antar lagi latar parkir candi,antar latar parkir candi,diantar pelataran parkir candi,antar lagi latar parkir candi,antar latar parkir candi,diantar pelataran parkir candi,antar lagi latar parkir candi,antar latar parkir candi,positif,fasilitas
tiket domestik dewasa anak kebetulan kita datang weekdays,tiket domestik dewasa anak kebetulan datang weekdays,tiket domestik dewasa anak betul kita datang weekdays,tiket domestik dewasa anak betul datang weekdays,tiket domestik dewasa anak kebetulan datang weekdays,tiket domestik dewasa anak betul kita datang weekdays,tiket domestik dewasa anak betul datang weekdays,tiket domestik dewasa anak kebetulan datang weekdays,tiket domestik dewasa anak betul kita datang weekdays,tiket domestik dewasa anak betul datang weekdays,positif,fasilitas
mungkin karena terdapat banyak atribut jawa beberapa lukisan tokoh ternama dari tanah jawa saat,atribut jawa lukisan tokoh ternama tanah jawa,mungkin karena dapat banyak atribut jawa beberapa lukis tokoh nama dari tanah jawa saat,atribut jawa lukis tokoh nama tanah jawa,atribut jawa lukisan tokoh ternama tanah jawa,mungkin karena dapat banyak atribut jawa beberapa lukis tokoh nama dari tanah jawa saat,atribut jawa lukis tokoh nama tanah jawa,atribut jawa lukisan tokoh ternama tanah jawa,mungkin karena dapat banyak atribut jawa beberapa lukis tokoh nama dari tanah jawa saat,atribut jawa lukis tokoh nama tanah jawa,positif,serbaneka
selama didalam akan diiringi oleh lantunan musik jawa,didalam diiringi oleh lantunan musik jawa,lama dalam akan iring oleh lantun musik jawa,dalam iring oleh lantun musik jawa,didalam diiringi oleh lantunan musik jawa,lama dalam akan iring oleh lantun musik jawa,dalam iring oleh lantun musik jawa,didalam diiringi oleh lantunan musik jawa,lama dalam akan iring oleh lantun musik jawa,dalam iring oleh lantun musik jawa,positif,fasilitas
