Review_Bersih,Review_Stopwords,Review_Stemming,Review_Stop_Stem,Review_Stop_Joined,Review_Stem_Joined,Review_Stop_Stem_Joined,Review_Stop_Neg,Review_Stem_Neg,Review_Stop_Stem_Neg,Sentibar,Aspbar
tempatnya sangat bagus luas butuh untuk mengelilingi tempat melihat banyak relief yang setiap dindingnya untuk yang dari luar indonesia,tempatnya bagus luas butuh mengelilingi tempat melihat relief dindingnya luar indonesia,tempat sangat bagus luas butuh untuk keliling tempat lihat banyak relief yang tiap dinding untuk yang dari luar indonesia,tempat bagus luas butuh keliling tempat lihat relief dinding luar indonesia,tempatnya bagus luas butuh mengelilingi tempat melihat relief dindingnya luar indonesia,tempat sangat bagus luas butuh untuk keliling tempat lihat banyak relief yang tiap dinding untuk yang dari luar indonesia,tempat bagus luas butuh keliling tempat lihat relief dinding luar indonesia,tempatnya bagus luas butuh mengelilingi tempat melihat relief dindingnya luar indonesia,tempat sangat bagus luas butuh untuk keliling tempat lihat banyak relief yang tiap dinding untuk yang dari luar indonesia,tempat bagus luas butuh keliling tempat lihat relief dinding luar indonesia,positif,lokasi
ingin balik lagi kesini banyak situs budaya sejarah disini,ingin balik kesini situs budaya sejarah disini,ingin balik lagi kesini banyak situs budaya sejarah sini,ingin balik kesini situs budaya sejarah sini,ingin balik kesini situs budaya sejarah disini,ingin balik lagi kesini banyak situs budaya sejarah sini,ingin balik kesini situs budaya sejarah sini,ingin balik kesini situs budaya sejarah disini,ingin balik lagi kesini banyak situs budaya sejarah sini,ingin balik kesini situs budaya sejarah sini,positif,lokasi
keseluruhan senang banget bisa wisata kesini pemandangan dari atas candi sungguh indah bisa foto stupa juga,keseluruhan senang banget wisata kesini pemandangan atas candi indah foto stupa,seluruh senang banget bisa wisata kesini pandang dari atas candi sungguh indah bisa foto stupa juga,seluruh senang banget wisata kesini pandang atas candi indah foto stupa,keseluruhan senang banget wisata kesini pemandangan atas candi indah foto stupa,seluruh senang banget bisa wisata kesini pandang dari atas candi sungguh indah bisa foto stupa juga,seluruh senang banget wisata kesini pandang atas candi indah foto stupa,keseluruhan senang banget wisata kesini pemandangan atas candi indah foto stupa,seluruh senang banget bisa wisata kesini pandang dari atas candi sungguh indah bisa foto stupa juga,seluruh senang banget wisata kesini pandang atas candi indah foto stupa,positif,lokasi
borobudur merupakan candi budha dikenal sebagai candi terbesar indonesia bahkan seluruh dunia,borobudur merupakan candi budha dikenal candi terbesar indonesia seluruh dunia,borobudur rupa candi budha kenal bagai candi besar indonesia bahkan seluruh dunia,borobudur rupa candi budha kenal candi besar indonesia seluruh dunia,borobudur merupakan candi budha dikenal candi terbesar indonesia seluruh dunia,borobudur rupa candi budha kenal bagai candi besar indonesia bahkan seluruh dunia,borobudur rupa candi budha kenal candi besar indonesia seluruh dunia,borobudur merupakan candi budha dikenal candi terbesar indonesia seluruh dunia,borobudur rupa candi budha kenal bagai candi besar indonesia bahkan seluruh dunia,borobudur rupa candi budha kenal candi besar indonesia seluruh dunia,positif,lokasi
candi budha terbesar berada kota magelang provinsi jawa tengah indonesia,candi budha terbesar kota magelang provinsi jawa tengah indonesia,candi budha besar ada kota magelang provinsi jawa tengah indonesia,candi budha besar kota magelang provinsi jawa tengah indonesia,candi budha terbesar kota magelang provinsi jawa tengah indonesia,candi budha besar ada kota magelang provinsi jawa tengah indonesia,candi budha besar kota magelang provinsi jawa tengah indonesia,candi budha terbesar kota magelang provinsi jawa tengah indonesia,candi budha besar ada kota magelang provinsi jawa tengah indonesia,candi budha besar kota magelang provinsi jawa tengah indonesia,positif,lokasi
sudah beberpa kali kesini teratur kesini tempatnya semakin rapih bersih,beberpa kali kesini teratur kesini tempatnya semakin rapih bersih,sudah beberpa kali kesini atur kesini tempat makin rapih bersih,beberpa kali kesini atur kesini tempat makin rapih bersih,beberpa kali kesini teratur kesini tempatnya semakin rapih bersih,sudah beberpa kali kesini atur kesini tempat makin rapih bersih,beberpa kali kesini atur kesini tempat makin rapih bersih,beberpa kali kesini teratur kesini tempatnya semakin rapih bersih,sudah beberpa kali kesini atur kesini tempat makin rapih bersih,beberpa kali kesini atur kesini tempat makin rapih bersih,positif,lokasi
kali bersama keluarga besar keindahaannya tetap sama tapi sedang sedikit renovasi atas,kali bersama keluarga besar keindahaannya sedang sedikit renovasi atas,kali sama keluarga besar keindahaannya tetap sama tapi sedang sedikit renovasi atas,kali sama keluarga besar keindahaannya sedang sedikit renovasi atas,kali bersama keluarga besar keindahaannya sedang sedikit renovasi atas,kali sama keluarga besar keindahaannya tetap sama tapi sedang sedikit renovasi atas,kali sama keluarga besar keindahaannya sedang sedikit renovasi atas,kali bersama keluarga besar keindahaannya sedang sedikit renovasi atas,kali sama keluarga besar keindahaannya tetap sama tapi sedang sedikit renovasi atas,kali sama keluarga besar keindahaannya sedang sedikit renovasi atas,positif,lokasi
area candi sangat terawat baik,area candi terawat baik,area candi sangat awat baik,area candi awat baik,area candi terawat baik,area candi sangat awat baik,area candi awat baik,area candi terawat baik,area candi sangat awat baik,area candi awat baik,positif,lokasi
tempatnya bagus banget bersih,tempatnya bagus banget bersih,tempat bagus banget bersih,tempat bagus banget bersih,tempatnya bagus banget bersih,tempat bagus banget bersih,tempat bagus banget bersih,tempatnya bagus banget bersih,tempat bagus banget bersih,tempat bagus banget bersih,positif,lokasi
salah satu lokasi yang terkenal jawa tengah dengan pemandangan situasi alam yang mengagumkan sekali,satu lokasi terkenal jawa tengah pemandangan situasi alam mengagumkan,salah satu lokasi yang kenal jawa tengah dengan pandang situasi alam yang kagum sekali,satu lokasi kenal jawa tengah pandang situasi alam kagum,satu lokasi terkenal jawa tengah pemandangan situasi alam mengagumkan,salah satu lokasi yang kenal jawa tengah dengan pandang situasi alam yang kagum sekali,satu lokasi kenal jawa tengah pandang situasi alam kagum,satu lokasi terkenal jawa tengah pemandangan situasi alam mengagumkan,salah satu lokasi yang kenal jawa tengah dengan pandang situasi alam yang kagum sekali,satu lokasi kenal jawa tengah pandang situasi alam kagum,positif,lokasi
candi terletak magelang sekitar dari yogyakarta,candi terletak magelang sekitar yogyakarta,candi letak magelang sekitar dari yogyakarta,candi letak magelang sekitar yogyakarta,candi terletak magelang sekitar yogyakarta,candi letak magelang sekitar dari yogyakarta,candi letak magelang sekitar yogyakarta,candi terletak magelang sekitar yogyakarta,candi letak magelang sekitar dari yogyakarta,candi letak magelang sekitar yogyakarta,positif,lokasi
saya melihatnya bahwa candi luar biasa megah,melihatnya bahwa candi luar biasa megah,saya lihat bahwa candi luar biasa megah,lihat bahwa candi luar biasa megah,melihatnya bahwa candi luar biasa megah,saya lihat bahwa candi luar biasa megah,lihat bahwa candi luar biasa megah,melihatnya bahwa candi luar biasa megah,saya lihat bahwa candi luar biasa megah,lihat bahwa candi luar biasa megah,positif,lokasi
karena candi memiliki banyak sekali tangga yang harus panjat,candi memiliki tangga panjat,karena candi milik banyak sekali tangga yang harus panjat,candi milik tangga panjat,candi memiliki tangga panjat,karena candi milik banyak sekali tangga yang harus panjat,candi milik tangga panjat,candi memiliki tangga panjat,karena candi milik banyak sekali tangga yang harus panjat,candi milik tangga panjat,positif,lokasi
tangga batunya tinggi tinggi,tangga batunya tinggi tinggi,tangga batu tinggi tinggi,tangga batu tinggi tinggi,tangga batunya tinggi tinggi,tangga batu tinggi tinggi,tangga batu tinggi tinggi,tangga batunya tinggi tinggi,tangga batu tinggi tinggi,tangga batu tinggi tinggi,positif,lokasi
tempatnya juga bersih,tempatnya bersih,tempat juga bersih,tempat bersih,tempatnya bersih,tempat juga bersih,tempat bersih,tempatnya bersih,tempat juga bersih,tempat bersih,positif,lokasi
wajib dikunjungi,wajib dikunjungi,wajib kunjung,wajib kunjung,wajib dikunjungi,wajib kunjung,wajib kunjung,wajib dikunjungi,wajib kunjung,wajib kunjung,positif,lokasi
harus naik tangga dahulu sampai puncaknya tapi puncak bagus banget viewnya,naik tangga puncaknya puncak bagus banget viewnya,harus naik tangga dahulu sampai puncak tapi puncak bagus banget viewnya,naik tangga puncak puncak bagus banget viewnya,naik tangga puncaknya puncak bagus banget viewnya,harus naik tangga dahulu sampai puncak tapi puncak bagus banget viewnya,naik tangga puncak puncak bagus banget viewnya,naik tangga puncaknya puncak bagus banget viewnya,harus naik tangga dahulu sampai puncak tapi puncak bagus banget viewnya,naik tangga puncak puncak bagus banget viewnya,positif,lokasi
nyampai candi disambut berbagai titik yang menarik,nyampai candi disambut berbagai titik menarik,nyampai candi sambut bagai titik yang tarik,nyampai candi sambut bagai titik tarik,nyampai candi disambut berbagai titik menarik,nyampai candi sambut bagai titik yang tarik,nyampai candi sambut bagai titik tarik,nyampai candi disambut berbagai titik menarik,nyampai candi sambut bagai titik yang tarik,nyampai candi sambut bagai titik tarik,positif,lokasi
mata langsung terbelalak dalam museum bagus banget luar sama dalam sangat sangat jauh berbeda,mata langsung terbelalak museum bagus banget luar jauh berbeda,mata langsung belalak dalam museum bagus banget luar sama dalam sangat sangat jauh beda,mata langsung belalak museum bagus banget luar jauh beda,mata langsung terbelalak museum bagus banget luar jauh berbeda,mata langsung belalak dalam museum bagus banget luar sama dalam sangat sangat jauh beda,mata langsung belalak museum bagus banget luar jauh beda,mata langsung terbelalak museum bagus banget luar jauh berbeda,mata langsung belalak dalam museum bagus banget luar sama dalam sangat sangat jauh beda,mata langsung belalak museum bagus banget luar jauh beda,positif,lokasi
lokasinya sendiri dataran tinggi gunung merapi yang berudara cukup sejuk,lokasinya sendiri dataran tinggi gunung merapi berudara cukup sejuk,lokasi sendiri datar tinggi gunung rapi yang udara cukup sejuk,lokasi sendiri datar tinggi gunung rapi udara cukup sejuk,lokasinya sendiri dataran tinggi gunung merapi berudara cukup sejuk,lokasi sendiri datar tinggi gunung rapi yang udara cukup sejuk,lokasi sendiri datar tinggi gunung rapi udara cukup sejuk,lokasinya sendiri dataran tinggi gunung merapi berudara cukup sejuk,lokasi sendiri datar tinggi gunung rapi yang udara cukup sejuk,lokasi sendiri datar tinggi gunung rapi udara cukup sejuk,positif,lokasi
sementara ulen sentalu semua koleksi desain ditata dengan cantik elegan,sementara ulen sentalu koleksi desain ditata cantik elegan,sementara ulen sentalu semua koleksi desain tata dengan cantik elegan,sementara ulen sentalu koleksi desain tata cantik elegan,sementara ulen sentalu koleksi desain ditata cantik elegan,sementara ulen sentalu semua koleksi desain tata dengan cantik elegan,sementara ulen sentalu koleksi desain tata cantik elegan,sementara ulen sentalu koleksi desain ditata cantik elegan,sementara ulen sentalu semua koleksi desain tata dengan cantik elegan,sementara ulen sentalu koleksi desain tata cantik elegan,positif,lokasi
museum ullen sentalu berada daratan tinggi,museum ullen sentalu daratan tinggi,museum ullen sentalu ada darat tinggi,museum ullen sentalu darat tinggi,museum ullen sentalu daratan tinggi,museum ullen sentalu ada darat tinggi,museum ullen sentalu darat tinggi,museum ullen sentalu daratan tinggi,museum ullen sentalu ada darat tinggi,museum ullen sentalu darat tinggi,positif,lokasi
karena kita akan dibawa berkeliling menjelajahi museum dengan jalan naik turun berkelok kelok seperti labirin,dibawa berkeliling menjelajahi museum jalan naik turun berkelok kelok labirin,karena kita akan bawa keliling jajah museum dengan jalan naik turun kelok kelok seperti labirin,bawa keliling jajah museum jalan naik turun kelok kelok labirin,dibawa berkeliling menjelajahi museum jalan naik turun berkelok kelok labirin,karena kita akan bawa keliling jajah museum dengan jalan naik turun kelok kelok seperti labirin,bawa keliling jajah museum jalan naik turun kelok kelok labirin,dibawa berkeliling menjelajahi museum jalan naik turun berkelok kelok labirin,karena kita akan bawa keliling jajah museum dengan jalan naik turun kelok kelok seperti labirin,bawa keliling jajah museum jalan naik turun kelok kelok labirin,positif,lokasi
ditambah dengan desain museum menurut saya elegan,ditambah desain museum menurut elegan,tambah dengan desain museum turut saya elegan,tambah desain museum turut elegan,ditambah desain museum menurut elegan,tambah dengan desain museum turut saya elegan,tambah desain museum turut elegan,ditambah desain museum menurut elegan,tambah dengan desain museum turut saya elegan,tambah desain museum turut elegan,positif,lokasi
museum terletak daerah kawasan wisata kaliurang yang sejuk penuh dengan pegunungan,museum terletak daerah kawasan wisata kaliurang sejuk penuh pegunungan,museum letak daerah kawasan wisata kaliurang yang sejuk penuh dengan gunung,museum letak daerah kawasan wisata kaliurang sejuk penuh gunung,museum terletak daerah kawasan wisata kaliurang sejuk penuh pegunungan,museum letak daerah kawasan wisata kaliurang yang sejuk penuh dengan gunung,museum letak daerah kawasan wisata kaliurang sejuk penuh gunung,museum terletak daerah kawasan wisata kaliurang sejuk penuh pegunungan,museum letak daerah kawasan wisata kaliurang yang sejuk penuh dengan gunung,museum letak daerah kawasan wisata kaliurang sejuk penuh gunung,positif,lokasi
untuk anak anak atas tempat akan menarik untuk dikunjungi,anak anak atas tempat menarik dikunjungi,untuk anak anak atas tempat akan tarik untuk kunjung,anak anak atas tempat tarik kunjung,anak anak atas tempat menarik dikunjungi,untuk anak anak atas tempat akan tarik untuk kunjung,anak anak atas tempat tarik kunjung,anak anak atas tempat menarik dikunjungi,untuk anak anak atas tempat akan tarik untuk kunjung,anak anak atas tempat tarik kunjung,positif,lokasi
akses menuju lokasi harus pakai mobil pribadi sewa,akses menuju lokasi pakai mobil pribadi sewa,akses tuju lokasi harus pakai mobil pribadi sewa,akses tuju lokasi pakai mobil pribadi sewa,akses menuju lokasi pakai mobil pribadi sewa,akses tuju lokasi harus pakai mobil pribadi sewa,akses tuju lokasi pakai mobil pribadi sewa,akses menuju lokasi pakai mobil pribadi sewa,akses tuju lokasi harus pakai mobil pribadi sewa,akses tuju lokasi pakai mobil pribadi sewa,positif,lokasi
tempatnya bagus,tempatnya bagus,tempat bagus,tempat bagus,tempatnya bagus,tempat bagus,tempat bagus,tempatnya bagus,tempat bagus,tempat bagus,positif,lokasi
arsitekturnya juga bagus saya suka,arsitekturnya bagus suka,arsitektur juga bagus saya suka,arsitektur bagus suka,arsitekturnya bagus suka,arsitektur juga bagus saya suka,arsitektur bagus suka,arsitekturnya bagus suka,arsitektur juga bagus saya suka,arsitektur bagus suka,positif,lokasi
tempat historis banget,tempat historis banget,tempat historis banget,tempat historis banget,tempat historis banget,tempat historis banget,tempat historis banget,tempat historis banget,tempat historis banget,tempat historis banget,positif,lokasi
museum terletak daerah kaliurang,museum terletak daerah kaliurang,museum letak daerah kaliurang,museum letak daerah kaliurang,museum terletak daerah kaliurang,museum letak daerah kaliurang,museum letak daerah kaliurang,museum terletak daerah kaliurang,museum letak daerah kaliurang,museum letak daerah kaliurang,positif,lokasi
dekat dengan puncak gunung merapi dingin,dekat puncak gunung merapi dingin,dekat dengan puncak gunung rapi dingin,dekat puncak gunung rapi dingin,dekat puncak gunung merapi dingin,dekat dengan puncak gunung rapi dingin,dekat puncak gunung rapi dingin,dekat puncak gunung merapi dingin,dekat dengan puncak gunung rapi dingin,dekat puncak gunung rapi dingin,positif,lokasi
lokasi komplek kaliurang lereng gunung merapi,lokasi komplek kaliurang lereng gunung merapi,lokasi komplek kaliurang lereng gunung rapi,lokasi komplek kaliurang lereng gunung rapi,lokasi komplek kaliurang lereng gunung merapi,lokasi komplek kaliurang lereng gunung rapi,lokasi komplek kaliurang lereng gunung rapi,lokasi komplek kaliurang lereng gunung merapi,lokasi komplek kaliurang lereng gunung rapi,lokasi komplek kaliurang lereng gunung rapi,positif,lokasi
uniknya lagi museum terbagi dalam beberapa area yang dibagi sesuai dengan temanya,uniknya museum terbagi area dibagi sesuai temanya,unik lagi museum bagi dalam beberapa area yang bagi sesuai dengan tema,unik museum bagi area bagi sesuai tema,uniknya museum terbagi area dibagi sesuai temanya,unik lagi museum bagi dalam beberapa area yang bagi sesuai dengan tema,unik museum bagi area bagi sesuai tema,uniknya museum terbagi area dibagi sesuai temanya,unik lagi museum bagi dalam beberapa area yang bagi sesuai dengan tema,unik museum bagi area bagi sesuai tema,positif,lokasi
museum terletak taman wisata kaliurang,museum terletak taman wisata kaliurang,museum letak taman wisata kaliurang,museum letak taman wisata kaliurang,museum terletak taman wisata kaliurang,museum letak taman wisata kaliurang,museum letak taman wisata kaliurang,museum terletak taman wisata kaliurang,museum letak taman wisata kaliurang,museum letak taman wisata kaliurang,positif,lokasi
terletak lereng gunung merapi membuat udara ullen sentalu sangat sejuk menyegarkan,terletak lereng gunung merapi membuat udara ullen sentalu sejuk menyegarkan,letak lereng gunung rapi buat udara ullen sentalu sangat sejuk segar,letak lereng gunung rapi buat udara ullen sentalu sejuk segar,terletak lereng gunung merapi membuat udara ullen sentalu sejuk menyegarkan,letak lereng gunung rapi buat udara ullen sentalu sangat sejuk segar,letak lereng gunung rapi buat udara ullen sentalu sejuk segar,terletak lereng gunung merapi membuat udara ullen sentalu sejuk menyegarkan,letak lereng gunung rapi buat udara ullen sentalu sangat sejuk segar,letak lereng gunung rapi buat udara ullen sentalu sejuk segar,positif,lokasi
dari arah tugu jogja kita bisa langsung utara lurus terus saja kalau menggunakan motor melewati perkampungan penduduk jalan kampung,arah tugu jogja langsung utara lurus menggunakan motor melewati perkampungan penduduk jalan kampung,dari arah tugu jogja kita bisa langsung utara lurus terus saja kalau guna motor lewat kampung duduk jalan kampung,arah tugu jogja langsung utara lurus guna motor lewat kampung duduk jalan kampung,arah tugu jogja langsung utara lurus menggunakan motor melewati perkampungan penduduk jalan kampung,dari arah tugu jogja kita bisa langsung utara lurus terus saja kalau guna motor lewat kampung duduk jalan kampung,arah tugu jogja langsung utara lurus guna motor lewat kampung duduk jalan kampung,arah tugu jogja langsung utara lurus menggunakan motor melewati perkampungan penduduk jalan kampung,dari arah tugu jogja kita bisa langsung utara lurus terus saja kalau guna motor lewat kampung duduk jalan kampung,arah tugu jogja langsung utara lurus guna motor lewat kampung duduk jalan kampung,positif,lokasi
kalau pakai mobil bisa lewat jalan kaliurang,pakai mobil lewat jalan kaliurang,kalau pakai mobil bisa lewat jalan kaliurang,pakai mobil lewat jalan kaliurang,pakai mobil lewat jalan kaliurang,kalau pakai mobil bisa lewat jalan kaliurang,pakai mobil lewat jalan kaliurang,pakai mobil lewat jalan kaliurang,kalau pakai mobil bisa lewat jalan kaliurang,pakai mobil lewat jalan kaliurang,positif,lokasi
museum yang unik baik lokasi maupun tata letak ruang brgnya,museum unik baik lokasi maupun tata letak ruang brgnya,museum yang unik baik lokasi maupun tata letak ruang brgnya,museum unik baik lokasi maupun tata letak ruang brgnya,museum unik baik lokasi maupun tata letak ruang brgnya,museum yang unik baik lokasi maupun tata letak ruang brgnya,museum unik baik lokasi maupun tata letak ruang brgnya,museum unik baik lokasi maupun tata letak ruang brgnya,museum yang unik baik lokasi maupun tata letak ruang brgnya,museum unik baik lokasi maupun tata letak ruang brgnya,positif,lokasi
bersih,bersih,bersih,bersih,bersih,bersih,bersih,bersih,bersih,bersih,positif,lokasi
lokasi lereng gunung merapi diantara hutan sehingga sejuk,lokasi lereng gunung merapi diantara hutan sejuk,lokasi lereng gunung rapi antara hutan sehingga sejuk,lokasi lereng gunung rapi antara hutan sejuk,lokasi lereng gunung merapi diantara hutan sejuk,lokasi lereng gunung rapi antara hutan sehingga sejuk,lokasi lereng gunung rapi antara hutan sejuk,lokasi lereng gunung merapi diantara hutan sejuk,lokasi lereng gunung rapi antara hutan sehingga sejuk,lokasi lereng gunung rapi antara hutan sejuk,positif,lokasi
bagus banget tertatah rapih bersih,bagus banget tertatah rapih bersih,bagus banget tatah rapih bersih,bagus banget tatah rapih bersih,bagus banget tertatah rapih bersih,bagus banget tatah rapih bersih,bagus banget tatah rapih bersih,bagus banget tertatah rapih bersih,bagus banget tatah rapih bersih,bagus banget tatah rapih bersih,positif,lokasi
pantai bagus bersih,pantai bagus bersih,pantai bagus bersih,pantai bagus bersih,pantai bagus bersih,pantai bagus bersih,pantai bagus bersih,pantai bagus bersih,pantai bagus bersih,pantai bagus bersih,positif,lokasi
tempat yang cocok kunjungi saat berlibur,tempat cocok kunjungi berlibur,tempat yang cocok kunjung saat libur,tempat cocok kunjung libur,tempat cocok kunjungi berlibur,tempat yang cocok kunjung saat libur,tempat cocok kunjung libur,tempat cocok kunjungi berlibur,tempat yang cocok kunjung saat libur,tempat cocok kunjung libur,positif,lokasi
sudah lebih bersih dibandingkan kunjungan sebelumnya,bersih dibandingkan kunjungan sebelumnya,sudah lebih bersih banding kunjung belum,bersih banding kunjung belum,bersih dibandingkan kunjungan sebelumnya,sudah lebih bersih banding kunjung belum,bersih banding kunjung belum,bersih dibandingkan kunjungan sebelumnya,sudah lebih bersih banding kunjung belum,bersih banding kunjung belum,positif,lokasi
pemandangan pantai lautnya tetap menawan,pemandangan pantai lautnya menawan,pandang pantai laut tetap tawan,pandang pantai laut tawan,pemandangan pantai lautnya menawan,pandang pantai laut tetap tawan,pandang pantai laut tawan,pemandangan pantai lautnya menawan,pandang pantai laut tetap tawan,pandang pantai laut tawan,positif,lokasi
dekat dengan pusat perbelanjaan,dekat pusat perbelanjaan,dekat dengan pusat belanja,dekat pusat belanja,dekat pusat perbelanjaan,dekat dengan pusat belanja,dekat pusat belanja,dekat pusat perbelanjaan,dekat dengan pusat belanja,dekat pusat belanja,positif,lokasi
garis pantainya panjang,garis pantainya panjang,garis pantai panjang,garis pantai panjang,garis pantainya panjang,garis pantai panjang,garis pantai panjang,garis pantainya panjang,garis pantai panjang,garis pantai panjang,positif,lokasi
pantai yang panjang ombak sore yang landai,pantai panjang ombak sore landai,pantai yang panjang ombak sore yang landai,pantai panjang ombak sore landai,pantai panjang ombak sore landai,pantai yang panjang ombak sore yang landai,pantai panjang ombak sore landai,pantai panjang ombak sore landai,pantai yang panjang ombak sore yang landai,pantai panjang ombak sore landai,positif,lokasi
pantai bersih,pantai bersih,pantai bersih,pantai bersih,pantai bersih,pantai bersih,pantai bersih,pantai bersih,pantai bersih,pantai bersih,positif,lokasi
lokasi yang mudah dijangkau,lokasi mudah dijangkau,lokasi yang mudah jangkau,lokasi mudah jangkau,lokasi mudah dijangkau,lokasi yang mudah jangkau,lokasi mudah jangkau,lokasi mudah dijangkau,lokasi yang mudah jangkau,lokasi mudah jangkau,positif,lokasi
pantainya sangat luas indah kalau dijaga kebersihannya,pantainya luas indah dijaga kebersihannya,pantai sangat luas indah kalau jaga bersih,pantai luas indah jaga bersih,pantainya luas indah dijaga kebersihannya,pantai sangat luas indah kalau jaga bersih,pantai luas indah jaga bersih,pantainya luas indah dijaga kebersihannya,pantai sangat luas indah kalau jaga bersih,pantai luas indah jaga bersih,positif,lokasi
pantai yang cantik pasir yang memutih,pantai cantik pasir memutih,pantai yang cantik pasir yang mutih,pantai cantik pasir mutih,pantai cantik pasir memutih,pantai yang cantik pasir yang mutih,pantai cantik pasir mutih,pantai cantik pasir memutih,pantai yang cantik pasir yang mutih,pantai cantik pasir mutih,positif,lokasi
mall,mall,mall,mall,mall,mall,mall,mall,mall,mall,positif,serbaneka
pantai bersih,pantai bersih,pantai bersih,pantai bersih,pantai bersih,pantai bersih,pantai bersih,pantai bersih,pantai bersih,pantai bersih,positif,lokasi
pasirnya putih,pasirnya putih,pasir putih,pasir putih,pasirnya putih,pasir putih,pasir putih,pasirnya putih,pasir putih,pasir putih,positif,lokasi
sekitar pantai banyak restaurant hotel yang bagus,sekitar pantai restaurant hotel bagus,sekitar pantai banyak restaurant hotel yang bagus,sekitar pantai restaurant hotel bagus,sekitar pantai restaurant hotel bagus,sekitar pantai banyak restaurant hotel yang bagus,sekitar pantai restaurant hotel bagus,sekitar pantai restaurant hotel bagus,sekitar pantai banyak restaurant hotel yang bagus,sekitar pantai restaurant hotel bagus,positif,lokasi
